독일도 두 자릿수대 인플레 진입·세계 경제 우려 키우는 영국 총리 [신인규의 글로벌마켓 A/S],2022-09-29 22:58:50,한국경제TV,"<앵커>오늘 출발한 뉴욕 증시 주요 체크포인트 살펴보죠. 미국 현지에 나가 있는 특파원 연결되어 있습니다. 신인규 기자.<기자>네, 여기는 미국 동부시간 29일 오전 9시 31분입니다. 3대 지수 모두 어제의 반짝 상승 이후 다시 하락세로 향하는 모습입니다. 한때 연 3.7%까지 내려왔던 미 국채 10년물 금리는 3.8%를 개장 전 다시 넘었죠. 영국 중앙은행의 대규모 국채 매입으로 채권시장이 잠시 안정되는가 싶더니, 리즈 트러스 영국 총리가 감세 정책을 고수하겠다는 의지를 시장에 재차 밝히면서 불안 심리를 자극시킨 측면이 있을 겁니다.지금 특히 유럽 주요국들의 경제가 정상화될 수 있을까, 생각보다 위험하지 않을까 하는 우려가 시장에 점점 커지고 있다는 점을 염두에 두셔야겠습니다. 유로존 내 단일 국가 기준 최대 경제규모인 독일의 경제 성적표도 점차 나빠지는 것으로 관측됩니다. 독일의 9월 소비자물가지수 상승률은 전년 대비 10%로 집계되면서 예상치를 뛰어넘었고, 오늘은 당국으로부터 독일 가계의 천연 가스 소비가 지속 불가능할 정도로 높다는 말이 나왔습니다. 독일 가계와 소기업의 주간 천연가스사용량은 483기가와트시로 집계됐는데, 이는 주간 기준 지난 4년 평균보다 14.5% 높은 수준입니다.오늘 개장 전 나온 미국의 경제지표들도 정리해보죠. 미국의 2분기 GDP 확정치는 전분기 대비 -0.6%로 집계됐고요. 주요 고용지표 가운데 하나인 신규실업수당 청구 건수는 20만 건 아래로 떨어진 19만 3천 건을 기록했습니다. 당초 컨센서스는 21만 5천 건이었습니다.<앵커>프리마켓에서 움직이는 종목들도 살펴보죠. 오늘은 개장 전 실적을 발표한 기업들의 주가가 움직이는 모습이 보이고 있는데, 이 부분도 짚어볼까요.<기자>S&P 500 프리마켓 거래 상위 종목들 보면 대체로 2%대에 가까운 낙폭을 보이고 있습니다. 어제 상승분을 반납하는 모습인데요. 거래량 1위 종목인 애플이 2% 넘게 하락하는 것을 비롯해, 테슬라와 포드, 카니발, AMD 등 주요 종목들이 약세인 상황입니다.개장 실적을 발표한 기업들의 주가 흐름도 주목할 만 합니다. 미국 최대 중고차거래업체 카맥스, 티커종목명 KMX의 주가가 프리마켓에서 18% 넘게 급락중입니다. 카맥스는 개장 전 지난 6월부터 8월까지의 분기 실적을 발표했는데요. 매출과 주당순이익 모두 시장의 예상을 하회했습니다. 이 회사는 회계연도 2분기 기준 마지막 달인 8월에 중고차 판매가 급감했다고 밝혔습니다.이번달 중순까지 국내 투자자들의 매수 매도 결제가 많았던 종목이죠, 베드 배스 앤드 비욘드, 티커종목명 BBBY는 개장 전 시장 예상을 밑도는 실적을 내놨는데도 3.8%대 상승세를 보였습니다. 실적 자체는 좋지 않았지만 회생 계획을 반영한 기존의 가이던스는 그대로 유지했고, 베드 배스 관련 브랜드 충성 고객 확보를 위해 올 여름부터 도입한 포인트 적립제도인 '웰컴 리워즈' 프로그램 가입자가 640만명까지 늘었다는 소식은 투자 측면에서는 긍정적으로 해석될 수 있는 부분입니다. BBBY의 역시 이번에 발표한 실적은 6월부터 8월까지의 분기 실적입니다. 매출 14억 4천만 달러, 주당순손실 3.22달러의 실적을 내놓았습니다. 시장 예상치는 매출 14억 7천만 달러, 주당순손실 1.85달러 수준이었습니다.지금까지 뉴욕에서 한국경제TV 신인규입니다.",https://n.news.naver.com/mnews/article/215/0001057174?sid=101
"""역시 포르쉐""…상장 D-1, 공모가 '최상단' 82.5유로 확정",2022-09-29 19:46:10,머니투데이,"홀가 게어만 포르쉐코리아 대표가 14일 서울 강남구 청담스퀘어에서 신형 '911 GT3'와 '타이칸 크로스 투리스모'를 국내 공식 출시하며 소개하고 있다. /사진=김휘선 기자 hwijpg@독일 폭스바겐의 스포츠카 브랜드 포르쉐가 상장을 하루 앞두고 공모가를 주당 82.50유로(약 11만4000원)으로 설정했다. 이는 기존 희망 범위의 최상단이다. 28일(현지시간) 블룸버그통신과 월스트리트저널(WSJ) 등 주요 외신에 따르면 포르쉐는 29일 독일 프랑크푸르트 증시에 입성해 거래를 시작한다.글로벌 증시가 현금 유동성 축소와 증시 침체 우려가 커졌지만 포르쉐는 공모가를 최상단으로 설정했다. 향후 사업에 대한 자신감이 반영된 것이라는 분석이다.글로벌 투자은행 제프리스의  필립 후쇼스 애널리스트는 ""어려운 시장 상황에서 기업공개(IPO)를 할 수 있다면 이 사업의 매력을 보여주는 것""이라며 ""포르쉐는 따로 상장이 필요 없는 성숙하고 잘 알려진 기업""이라고 평가했다.포르쉐의 IPO 규모는 독일 증시 사상 최대다. 또 2011년 영국 런던 증시에서 스위스 광산업체 글렌코어가 상장으로 100억달러를 조달한 이후 유럽 최대 규모다. WSJ는 포르쉐가 공모가대로 상장하면 모회사 폭스바겐에 이어 단숨에 시가총액 세계 5위 완성차 제조업체가 된다고 분석했다.공모가가 최상단으로 정해지면서 포르쉐 시총은 750억 유로(약 103조원)에 이를 전망이다. 현재 완성차 업체 시총순위는 미국 테슬라, 일본 도요타, 중국 BYD, 독일 폭스바겐 순이다. 메르세데스-벤츠, 제너럴모터스(GM), 현대차그룹 등보다 큰 규모다.폭스바겐은 이번 상장을 통해 195억 유로(약 27조원)를 조달해 절반은 기존 주주들에게 배당한다. 나머지 절반은 전기차 및 전기차용 배터리 개발, 자율주행차 등 신기술 개발 등을 위한 자금으로 사용할 예정이다. 폭스바겐은 포르쉐 지분 75%를 보유한 대주주다.포르쉐의 모회사 폭스바겐은 오는 2026년까지 전기차 판매량을 전체의 4분의 1 수준으로 끌어올린다는 목표다. 블룸버그 인텔리전스는 2024년 폭스바겐의 전기차 판매량이 테슬라를 넘어설 것으로 예상했다. 폭스바겐은 향후 5년 간 전기차 사업에 500억달러를 투자한다는 계획이다.",https://n.news.naver.com/mnews/article/008/0004800687?sid=101
인플레法 충족 못한 현대차·기아…2025년까지 세제 혜택 못 받는다,2022-09-29 19:20:09,디지털타임스,"현지 공장 세워 대응 나섰지만""美 광물 40% 사용"" 조건 난관가격 경쟁 하락… 점유율 악재    아가 다음 달 4일부터 고성능 전기차 'The Kia EV6 GT(더 기아 이 브이 식스 지티)'를 출시한다고 29일 밝혔다. 사진은 EV6 GT.<사진=기아 제공>    미국의 '인플레이션 감축법'(IRA)에 국내 기업이 대응하기 쉽지 않을 것이라는 국책연구기관의 전망이 제기됐다. IRA는 미국 내에서 만든 전기자동차에만 보조금을 지급한다는 내용의 법안이다. 현대차는 미국 알라바마에, 기아는 조지아에 생산공장을 두기로 했지만, 생산능력과 시기 등에서 2025년까지는 지원을 받기가 어렵다는 게 연구기관의 판단이다. 산업연구원(KIET)은 29일 'IRA의 국내 산업 영향과 시사점' 보고서에서 현대차·기아의 미국시장 점유율이 최근 큰 폭으로 높아지고 있다고 분석했다. 작년까지만 하더라도 4.7%에 불과했으나, 올해는 1~7월 누계 기준으로 9.1%까지 올랐다. 이는 시장점유율 1위 기업인 테슬라 다음으로 높은 수치다. 미국 에너지부 자료를 보면 아이오닉5(2.8%)와 EV6(2.55%) 등의 선전이 두드려졌다. 수소전기차 넥쏘는 7월까지 300대가 팔려 0.05%의 점유율을 보였다. 제네시스 GV60의 경우 517대의 판매량으로 0.09%의 점유율을 기록했다. 그러나 이러한 신장세는 IRA 발효로 유지하기 힘들 것으로 보인다. IRA는 전기차용 배터리 핵심광물의 40% 이상을 미국이나 미국과의 자유무역협정(FTA) 체결국에서 추출·처리된 것을 사용해야 전기차 보조금의 절반(3750달러)을 받을 수 있다고 규정하고 있다. 배터리 제조에 사용된 주요부품도 50% 이상을 북미에서 제조·조립한 경우에 한해 보조금(3750달러)을 지급한다. 법안의 시행시기는 당장 내년부터다.산업연은 ""현대차·기아가 미국 시장에서 판매하는 전기차는 '최종조립' 조건 충족이 어렵다""고 지적했다. 현대차가 올 하반기부터 알라바마 공장을 개조 또는 증설해 GV70 일부를 생산할 예정이지만, 생산물량은 제한적일 것이라는 게 산업연의 설명이다. 기아의 조지아주 공장도 2025년부터 가동될 예정이다. 이에 해당 시기까지는 전기차 1대당 지급되는 최대 7500달러의 세제혜택을 받지 못할 것으로 예상된다.산업연은 ""포드, 제너럴모터스(GM) 등 미국 기업은 물론, 현재 북미에서 공장을 가동 중인 독일, 일본 등 경쟁사들의 차종들은 IRA 세제혜택 대상에 포함돼 우리 기업에 비해 상대적으로 가격 경쟁력 상승 효과를 누리게 됐다""며 ""시장 점유율을 빠르게 높이던 현대차·기아에게 IRA 발효는 큰 악재""라고 짚었다.한편, 주무부처인 산업통상자원부가 지난 5년 동안 대미 통상외교에 매년 수억원의 예산을 쓰고서도, IRA 입법 동향을 파악하지 못했다는 지적도 나왔다. 윤관석 더불어민주당 의원실이 산업부에서 받은 자료에 따르면 산업부는 올해 '아널드 앤 포터'를 포함한 미국 법무법인 4곳에 52만5680달러(약 7억5000만원)를 지출했다. 산업부 측은 ""IRA 법안은 소수의 미국 민주당 상원의원 주도로 비밀리에 추진돼 법안이 처음 공개되기 전까지 상당수 미국 의원들조차 내용을 잘 인지하지 못한 것으로 보인다""고 반박했다.",https://n.news.naver.com/mnews/article/029/0002756875?sid=101
[fn스트리트] 중국 전기차 BYD,2022-09-29 18:30:05,파이낸셜뉴스,"(한국자동차연구원 제공) /사진=뉴스1 중국의 전기차 메이커 BYD가 올 상반기 전 세계에서 64만7000대의 전기차를 팔아 세계 1위에 올랐다. 미국의 테슬라는 57만5000대로 2위에 머물렀고, 한국의 현대차·기아는 24만8000대로 5위를 기록했다. 왕촨푸 회장이 1995년 창립한 BYD는 '너의 꿈을 키워라(Build Your Dream)'의 영문 첫 글자에서 땄다. 영세 휴대폰 배터리 제조업체는 테슬라, 도요타 다음의 글로벌 시가총액 세계 3위의 완성차 업체로 우뚝 섰다.   BYD는 배터리+차량용 반도체+전자제어장치+모터 제조공정을 수직계열화한 세계 유일의 전기차 업체다. 배터리 세계 4위, 전력 반도체를 비롯한 차량용 반도체 시장점유율 세계 2위를 자랑한다. 자체 개발한 리튬인산철 배터리의 핵심 원자재인 리튬 광산을 소유하고 있기도 하다. 지난 3월 완성차 업체 중 최초로 내연기관 차량 생산을 전격 중단, 전기차 생산에 올인했다.   2008년 세계 최초로 양산형 플러그인 하이브리드차를 출시해 존재감을 알린 BYD는 전기차의 핵심인 배터리의 무게와 원가는 각각 낮추고 안전성은 올리면서 승기를 잡았다. 버크셔 해서웨이의 워런 버핏 회장이 지분 10%를 인수해 날개를 달아주었다. 이때 찰리 밍거 부회장은 ""에디슨의 기술력과 잭 웰치의 CEO 자질을 갖췄다""고 왕 회장을 추켜세웠다.   한국자동차연구원의 이호중 책임연구원은 최근 발표한 '왜 BYD의 성장에 주목하는가'라는 보고서에서 ""BYD의 성장은 그 자체로 전기차 대중화 시대를 여는 새로운 동력에 관한 실마리를 제공한다""면서 ""안정적 부품공급, 가성비 등 성장전략을 참고할 필요가 있다""고 말했다. 내년 한국과 일본에도 진출한다고 하니 세계 전기차 시장이 또 한번 요동칠 모양이다. 첫 한국 진출 상위모델은 4000만원대의 가성비와 완충 시 최대 700㎞를 달리는 만만찮은 스펙이 장착될 것으로 알려졌다. BYD 돌풍이 무섭다.   joo@fnnews.com 노주석 논설실장",https://n.news.naver.com/mnews/article/014/0004906663?sid=110
테슬라 사고 나면 그랜저 빌려줬는데…앞으론 G80으로 높여준다,2022-09-29 18:26:01,SBS Biz,"[앵커] 교통사고로 자동차가 고장 났을 때 보험사는 수리기간 동안 비슷한 급의 차를 빌릴 수 있도록 대차료라는 걸 지급합니다. 그런데 비싼 전기차도 내연기관차와 같은 급의 차만 빌릴 수 있는 대차료를 지급해 소비자 불만이 컸는데요.내달부터는 전기차나 SUV 차량 사고가 났을 경우 차량 가격에 맞게 대차료도 높아집니다.류정현 기자가 보도합니다. [기자] 테슬라 모델 X를 몰던 운전자 A 씨는 최근 교통사고로 차를 수리 맡기는 동안 동급의 SUV인 모하비를 렌트했습니다. 하지만 보험사에 비용을 청구하니 보험사는 그랜저를 기준으로 계산해 보험금을 줬습니다. 실제 비용보다 하루 4만 원 정도 적게 지급한 겁니다. 배터리 출력이 일정 수준을 넘는 전기차는 아무리 비싸도 가장 싼 대형 내연차를 빌릴 보험금만 주면 됐기 때문입니다. 하지만 앞으로는 비싼 전기차는 그에 상응하는 대차료를 받을 수 있게 됩니다. 앞선 A 씨의 경우라면 그랜저가 아닌, G80을 빌릴 수 있게 된다는 얘기입니다. [최진영 / 금융감독원 특수보험1팀장 : 친환경차 등에 대해서는 대차료가 적게 지급되고 있다는 민원들이 꾸준히 제기되었습니다. 향후 대차료를 받을 경우 관련 내용들을 잘 파악할 필요가 있겠습니다.]엔진 배기량이 기준이었던 다른 친환경차도 종류에 따라 새로운 기준이 만들어집니다. 국내에서 친환경차가 차지하는 비중은 5년 사이 4배 넘게 늘었습니다. 늘어난 소비자만큼 다양해진 요구에 따라 제도 개선에 나선 겁니다. [김필수 / 대림대 미래자동차학부 교수 : 액션플랜, 실제로 행위가 중요합니다. 결과가 도출이 돼야 되거든요. 따라서 정부가 모니터링을 해서 적극적으로 들여다봐야 된다고 보고 있습니다.]이번 대차료 합리화 방안은 내달 11일부터 시행됩니다. SBS Biz 류정현입니다.",https://n.news.naver.com/mnews/article/374/0000304643?sid=101
‘트윗 검사받기’ 참을 수 없는 일론 머스크 결국 항소,2022-09-29 18:11:02,국민일보,"일론 머스크 테슬라 최고경영자가 지난해 5월 30일(현지시간) 미국 플로리다주 케이프커내버럴의 미항공우주국(NASA) 로켓발사기지 케네디우주센터에서 스페이스X 로켓 발사에 성공한 뒤 환호하고 있다. AFP연합뉴스미국 전기차 기업 테슬라 최고경영자(CEO) 일론 머스크가 유일의 대중 소통창구인 SNS 트위터에 회사 재정 관련 글을 쓸 때 변호사의 검사를 받도록 제한한 미국 증권거래위원회(SEC) 조치를 결국 항소로 되받았다.머스크의 변호인은 28일(현지시간) “SEC와의 2018년 합의 사항 파기·수정을 요구하는 소장을 전날 미국 뉴욕 맨해튼 연방법원에 제출했다”며 “SEC의 조치는 정부가 씌운 입마개”라고 밝혔다. 그는 “머스크의 합법적인 발언권을 제약해 헌법에 위배된다”고 주장했다.머스크는 회사에 영향을 미칠 수 있는 트윗을 작성할 때마다 변호사의 승인을 얻어야 한다. 4년 전 주가조작 의심을 받은 탓이다.머스크는 2018년 8월 트위터에 “테슬라를 주당 420달러에 비상장 회사로 전환하는 것을 검토하고 있다. 자금은 확보돼 있다”고 적었다. 테슬라는 당시에도 전기차 시장의 선두주자로 꼽혔지만, 지금만큼의 성장을 이루지 못했다. 다른 성장주와 다르지 않았던 테슬라의 당시 주가는 300~400달러 사이에서 요동쳤다.사실상 상장폐지를 언급한 머스크의 트윗은 당시 테슬라 주가는 물론 미국 뉴욕 증권시장에서 기술주의 혼란을 몰고 왔다. 결국 머스크는 테슬라 상폐 계획을 철회했다. 하지만 손해를 입은 일부 테슬라 주주들은 트윗의 목적을 주가 조작으로 보고 머스크와 테슬라를 상대로 집단소송을 제기했다.SEC는주가에 영향을 미칠 목적으로 상폐 트윗을 올렸을 가능성에 주목하고 머스크를 증권사기 혐의로 고소했다. 머스크는 모두 4000만 달러의 벌금을 내고, 트윗을 작성할 때 변호사의 확인을 받도록 SEC와 합의했다. 제한되는 트윗은 이후 테슬라의 생산 지표, 신산업 계획, 재정 상태와 관련한 것으로 구체화됐다.머스크는 지난 3월 SEC와의 합의를 ‘표현의 자유 침해’라며 조치를 중단하는 명령을 내려달라고 법원에 요청했다. 하지만 1심 재판부는 머스크의 요청을 기각했다.",https://n.news.naver.com/mnews/article/005/0001556190?sid=101
"월가 ""소매업 예상만큼 나쁘진 않아…월마트·타깃 주목"" [월가월부]",2022-09-29 17:48:02,매일경제,"S&P500 3분기 어닝시즌순익 성장률 3.2% 예상되지만에너지기업 제외 땐 되레 하락기업 실적개선 기대감 낮아져""베스트바이 등 소매유통업실적대비 주가 하락 과도""모건스탠리 유망종목 추천◆ 서학개미 투자 길잡이 ◆      10월 중순께 본격적으로 시작될 3분기 어닝시즌에 대한 기대감이 빠른 속도로 낮아지고 있다. 월가에선 이익 전망치 하향이 과한 종목들에 주목하라고 조언하고 있다.29일 월스트리트저널(WSJ) 등 외신에 따르면 월가 연구원들은 3분기 기업 실적에 대한 눈높이를 낮추고 있다. 최근 팩트셋이 발간한 자료에 따르면 올해 3분기 S&P500 기업들의 전년 동기 대비 이익 성장률 컨센서스는 약 3.2%다. 지난 6월 30일 3분기 기업 이익 성장 전망치는 9.8% 수준이었는데 약 석 달 만에 3분의 1 이하까지 떨어졌다. 3.2%는 2020년 3분기 이후 최악의 성적표라는 게 팩트셋의 설명이다.이와 동시에 현재 뉴욕 증시 이익 전망치는 에너지 기업들의 착시 효과가 가리고 있다는 분석도 나온다. 올해 고유가 수혜에 힘입어 에너지 기업들의 이익이 크게 증가했는데, 이로 인해 평균 성장률도 올라 실제 수치를 왜곡하고 있다는 지적이다.레피니티브는 3분기 S&P500 전체 기업의 이익 성장률이 팩트셋보다 살짝 높은 4.6%를 기록할 것이라고 전망했다. 단 에너지 업종 기업들을 제외하면 1.9% 역성장할 것으로 내다봤다. 3분기 에너지 기업들의 순이익 성장률 전망이 118%에 달해 평균을 끌어올렸기 때문이다. 지난 2분기 미국 기업들의 실적도 이와 유사했다. 레피니티브 기준 2분기 S&P500 기업들의 순이익 성장률은 8.4%였다. 전년 대비 순이익이 약 295.5% 급증했던 에너지 기업들을 제외하면 순이익은 오히려 2.1% 감소했다. 단 글로벌 자산운용사 피델리티에 따르면 S&P500 기준 에너지 기업들이 차지하고 있는 시가총액 비중은 27일(현지시간) 종가 기준 약 6.14%에 불과하다. 이 역시 올해 고유가에 힘입어 에너지 기업들 주가가 크게 올랐기 때문에 늘어난 수치다. WSJ에 따르면 연초 에너지 기업들의 시총 비중은 고작 2.7%였다. 혼자 이익이 급증한 에너지 업종이 낮은 시총 비중에도 평균 수치를 끌어올리고 있는 모양새다.이에 따라 3분기 어닝시즌을 앞두고 증시 불안이 커지고 있다는 걱정 섞인 목소리도 나온다. 나이절 볼턴 블랙록 공동 최고투자책임자(CIO)는 최근 인터뷰에서 ""아직 미국 기업들에 대한 이익 전망치 하향은 본격적으로 시작되지 않았다""며 ""이미 각 기업 경영진의 우려가 커지고 있고, 내년 이익 전망치는 상당히(substantial) 떨어질 것으로 보고 있다""고 밝혔다.미국 투자 전문매체 배런스에 따르면 모건스탠리는 이익 전망이 크게 하락한 기업들에 투자하라고 조언하고 있다. 주가 하락폭이 크고 이익 전망치가 낮으면 기대감이 작아 오히려 넘을 허들도 함께 낮아지기 때문이다. 마이클 윌슨 모건스탠리 연구원은 ""투자자들이 어려운 거시경제 환경에서 상대적으로 가치가 높은 종목을 찾고 있다""며 ""이익 전망이 크게 감소한 기업들을 찾는 전략이 유효할 수 있는 이유""라고 설명했다.모건스탠리가 대표적으로 추천한 종목은 타깃, 월마트, 베스트바이 등이다. 이들 회사는 모두 소매 유통 기업이다. 베스트바이는 전자제품 전문 유통사, 타깃과 월마트는 다양한 제품을 판매하는 종합 유통 기업이다.내년 주당순이익(EPS) 전망치가 가장 크게 떨어진 곳은 베스트바이다. 지난 3월 이후 내년 EPS 전망치가 약 46% 감소했다. 타깃과 월마트는 각각 36%, 12%의 하락폭을 기록했다. 타깃은 지난 2분기 팬데믹 때 대량 주문했던 의류, 가구와 같은 악성 재고를 처리하는 과정에서 순이익이 전년 동기 대비 90% 급감했다. 재고 문제가 떠오른 영향으로 EPS 전망치도 하락했다. 전자제품을 중점적으로 취급하는 베스트바이도 경기소비재 수요 부진 영향을 받았다. 월마트는 식료품 등 필수소비재 매출 비중이 높아 영향이 덜했다.2분기에도 실적 발표 직전까지 이익 전망이 크게 낮아졌던 일부 기업이 오히려 어닝서프라이즈를 달성한 사례들이 있었다. 대표적으로 테슬라는 2분기 실적 발표 전 상하이 봉쇄 영향에 지난 4월 초부터 석 달 만에 EPS 전망치가 약 28% 줄어들었다. 이런 우려와 달리 테슬라는 컨센서스를 25% 이상 웃도는 2분기 EPS를 기록해 어닝서프라이즈를 달성했다. 모건스탠리가 추천한 베스트바이도 지난 8월 말 실적을 발표하기 전 7월에 수요 둔화를 이유로 선제적으로 분기, 연간 가이던스를 낮췄다. 월마트도 이와 유사하게 지난달 실적 발표 2주 전 인플레이션을 이유로 전년 대비 EPS 감소폭이 예상보다 클 것이라고 경고했다. 결국 두 기업은 매출과 순이익 모두 컨센서스를 뛰어넘는 어닝서프라이즈를 달성했다.한편 기업들의 이익을 압박하는 요소로는 인플레이션, 강달러 현상, 높은 임금 등이 꼽힌다. 주요 6개국 통화 대비 달러 가치를 나타내는 달러인덱스는 올해 17% 이상 급등했다. 이로 인해 수출 비중이 높은 기업들은 환차손 영향에 이익 압박을 받고 있다. 또 높은 인플레이션으로 인해 소비자들의 지갑이 얇아져 경기소비재 기업들과 유통 기업들의 이익이 감소하고 있다. 또 세인트루이스 연방준비은행 경제통계(FRED)에 따르면 8월 미국 내 평균 시간당 임금은 약 5.2% 늘어났다. 높은 임금은 전 산업에 걸쳐 기업들에 부담이 되고 있다는 분석이 나온다.      ※ 월가 투자정보는 유튜브 '월가월부'에서 확인하세요. 자세한 해외 증시와 기업 분석 정보를 매일경제 해외 특파원들이 생생하게 전달해 드립니다.",https://n.news.naver.com/mnews/article/009/0005023806?sid=101
