"美 월저널 ""한국인, 바이든에 실망…美 투자에도 전기차 차별""",2022-09-29 13:39:01,매일경제,"""미 일자리 창출 1위 국가인데…"" IRA 韓 차별에 비판여론 확산    조지 바이든 미국 대통령이 지난 14일 디트로이트 오토쇼에 참석해 자국내 전기차 육성에 대해 연설하고 있다. [AP = 연합뉴스] ""조 바이든 미국 행정부가 신형 전기차 보조금 문제로 한국의 반발에 직면했다. 북미산 전기차에만 7500달러 세금혜택을 주는 바람에 현대차와 기아와 같은 자동차회사에 타격을 줬다.""월스트리트저널(WSJ)이 28일(현지시간) 미 인플레이션 감축법(IRA) 시행으로 인한 한국산 전기차 차별이 한미관계에 미치는 부정적인 영향을 조명했다.WSJ은 바이든 대통령이 지난 5월 방한했을 때 정의선 현대차그룹 회장에게 ""우리는 당신을 실망시키지 않을 것""이라고 했던 말을 상기시켰다. 당시 정 회장은 조지아주 전기차 공장, 로보틱스와 도심항공모빌리티(UAM), 자율주행 소프트웨어, 인공지능 등 분야에 총 105억 달러 규모의 대미 투자를 약속한 바 있다. 그러나 넉달 뒤 ""정 회장, 현대차, 많은 한국인들은 (바이든 대통령에게) 실망감을 느끼고 있다""고 WSJ은 전했다. 한국에서 전량 생산되어 미국에 수출된 현대차 아이오닉5, 기아 EV6 등 전기차는 지난 달 16일 인플레 감축법 시행 이후 미 보조금 지급대상에서 배제된 상태다. WSJ은 현대차와 기아가 미국 전기차 시장점유율 9%를 차지하면서 테슬라에 이어 2위로 선전하는 상황에서 보조금 제외라는 날벼락을 맞았다고 설명했다. 앞으로 한국의 대미 전기차 수출은 연간 10만대 이상 감소할 것으로 관측된다.특히 WSJ은 인플레 감축법 시행으로 유럽연합과 일본산 자동차도 차별받지만 한국의 반발 여론이 가장 크다고 전했다. 새로운 보수성향 리더인 윤석열 대통령이 미국과의 파트너십 강화를 우선적으로 추진하지만, 이에 걸맞는 대우를 받지 못해 한국의 분노와 배신감이 커졌다고 했다.한국은 중국의 반발에도 불구하고 미국의 인도태평양 전략에 동참했으며 미국 주도의 4개국 반도체 공급망 협의체 참여도 결정했다. 또 한국은 올해 상반기 미국에서 전기차 배터리 투자를 통해 3만5000개 신규 일자리를 만들었고 베트남, 일본, 캐나다를 제치고 대미 일자리창출 1위 국가를 차지했다.한·미 자유무역협정(FTA) 협상 당시 미국 측 수석대표를 맡았던 웬디 커틀러 전 미국무역대표부(USTR) 부대표는 ""한국인이 화가 나고 실망하는 것을 이해할 수 있다""고 강조했다.WSJ는 한국에서의 대미 역풍과 관련해 ""바이든 행정부가 해외에서 긴밀한 안보동맹을 추구하면서 국내에서 경제적 승리를 추구하다보니 발생할 수 있는 마찰""이라며 ""중국과의 경쟁이 심화되는 가운데 미국의 두 가지 목표는 충돌 위험을 증가시킨다""고 진단했다.",https://n.news.naver.com/mnews/article/009/0005023616?sid=104
"테슬라, 에어비앤비 공동 창립자 이사회 영입",2022-09-29 13:04:01,디지털데일리,- 이사회 보수는 안 받아   [디지털데일리 정혜원 기자] 테슬라가 에어비앤비 공동 창립자를 이사회 멤버로 영입했다.   .  28일(현지시간) 테슬라는 에어비앤비를 공동 설립한 조 게비아<사진>를 이사회 일원으로 추가했다고 미국 증권거래위원회에 보고했다.  게비아는 오라클 회장 래리 엘리슨이 사임하면서 테슬라 이사회에 합류하게 됐다. 아직 이사회 내 구체적 역할은 정해지지 않았다.    그는 지난 7월 에어비앤비에서 맡은 책임을 내려놨지만 이사직은 유지하고 있다. 난민들의 임시 주거지를 찾을 수 있도록 돕는 비영리 단체 의장도 맡고 있다.,https://n.news.naver.com/mnews/article/138/0002133621?sid=105
"금감원, 친환경·다운사이징·SUV 車 보험 대차료 지급 기준 개선",2022-09-29 12:02:01,서울경제,"[서울경제] 금융감독원이 친환경차 보급확대 등 자동차 시장 환경이 변화함에 따라 기존 내연기관 세단 중심의 자동차 보험 대차료 지급기준을 스포츠유틸리티차(SUV)와 전기차와 하이브리드 등 친환경 차량에도 적합하도록 개선하기로 했다. 금감원은 29일 엔진배기량을 주로 고려하는 현행 내연기관 및 세단 중심의 자동차 보험료 대차료 지급기준을 개선한다고 밝혔다. 자동차 보험 대차는 자동차가 파손돼 가동하지 못하는 동안 다른 자동차를 대신 사용하게 끔 하는 제도인데 대개 배기량이나 연식이 유사한 동급의 대여 자동차 중 최저 요금의 대여차를 빌리는데 필요한 통상의 요금을 지급한다. 바뀐 기준에 따르면 우선 현재 전기차의 경우 390㎾ 이상의 고출력 전기차에 대한 대차료 지급 기준이 없었는데 앞으로 고출력 전기차 구간을 신설하기로 했다. 고출력 전기차의 경우 높은 차량가액에 비해 대차료가 낮게 산정되는 등 소비자 불만이 지속적으로 제기돼 왔다. 지급 기준이 개선되면 포르쉐 타이칸(390～560㎾) BMW i4 M(400㎾), 아우디 e-트론GT(390㎾), 테슬라 모델X(500~895㎾), 모델S(500~895㎾) 등 최상급 전기차종의 경우 내연기관의 초대형(배기량 3500㏄ 수준) 기준으로 대차료를 산정하게 된다. 하이브리드(내연기관 엔진과 전기 배터리를 함께 사용하는 차량)의 경우 현재까지는 엔진 배기량만 고려했지만 추가된 배터리 출력을 고려하기로 했고 터보 등 다운사이징 엔진을 사용하는 차량도 엔진 출력까지 고려해 대차료 지급을 할 수 있도록 했다. 예컨대 1600㏄ 다운사이징 차량의 경우 엔진출력은 2000㏄급 일반차량과 비슷한데 지금까지는 배기량만으로 대차료를 산정해 일반 엔진 1600㏄ 차량을 기준으로 대차료를 산정했지만 앞으로는 일반엔진 차량 기준(2000㏄)으로 대차료를 산정하도록 했다. 아울러 SUV의 경우 현재는 일반 세단 차량 기준으로 대차료를 산정했는데 앞으로는 SUV 차량 기준으로 대차료를 산정하도록 바꿨다. 금감원은 ""친환경 차량 및 SUV 차량에 대한 합리적인 대차료 지급기준이 마련돼 소비자의 권익이 크게 제고될 것""이라며 ""대차료 관련 분쟁 해소로 자동차보험 제도에 대한 소비자들의 신뢰가 높아질 것""이라고 기대했다.",https://n.news.naver.com/mnews/article/011/0004104525?sid=101
전기차·SUV 사고시 대차료 합리화된다,2022-09-29 12:02:04,헤럴드경제,"기존에는 내연기관·세단 기준으로 지급친환경차·SUV 특성 반영해 대차료 상향    [헤럴드경제=김성훈 기자] 친환경차와 SUV의 자동차보험 대차료(자동차 수리기간 다른 자동차를 렌트하는 비용) 지급액이 상향된다.금감원은 친환경차 및 SUV 보급 확산에 맞춰 대차료 지급기준을 개선한다고 29일 밝혔다. 그간에는 내연기관 세단 차량 중심으로 설계돼 있어 친환경차, SUV 등은 불리하다는 민원이 지속적으로 제기된 바 있다.현재 자동차보험 약관상에는 동급(배기량, 연식이 유사한 차량)의 대여자동차 중 최저요금의 대여자동차를 빌리는데 소요되는 통상의 요금을 지급한다고 규정돼 있다.우선 전기차는 배터리 출력이 390킬로와트(kw) 이상인 차량에 대해서는 내연기관 초대형(배기량 3500cc 수준) 기준으로 대차료를 산정하도록 개선했다.기존에는 고출력 전기차가 높은 차량가액에 비해 대차료가 낮게 산정되는 문제가 있었다.가령 테슬라 모델S의 경우 기존에는 그랜져 2.2나 K7 2.2를 기준으로 대차료가 산정됐는데, 앞으로는 G80 3.3, K9 3.3을 기준으로 바뀐다.하이브리드 차량도 추가된 배터리 용량을 감안해 동일 모델의 내연기관 차량 기준으로 대차료가 산정된다. 기존에는 추가된 배터리 용량을 반영하지 않고 배기량만을 기준으로 대차료를 산정해왔다.가령 배기량 1597cc에 추가된 배터리 용량(44.2kw)을 감안하면 배기량 2000cc와 유사한데, 이를 인정해주겠다는 것이다.다운사이징 엔진(기존 엔진 배기량을 줄이면서 출력을 높이는 고효율 엔진)을 장착한 차량은 동일 모델의 일반엔진 차량과 성능이 유사한 점을 감안해, 일반 엔진 장착 차량을 기준으로 대차료를 산정하게 된다. 기존에는 배기량만을 기준으로 산정해왔다.SUV의 대차료는 동급 SUV 차량의 최저 대여요금을 한도로 대차료를 지급하게 된다. 기존에는 동급의 세단 차량을 한도로 대차료를 지급해 분쟁이 있었다.이번 방안은 10월 11일부터 시행될 예정이다.금감원은 친환경차 등 일부 차량의 경우 대차료 산정시 배기량 뿐만 아니라 차량의 성능을 제대로 반영할 수 있도록 자동차보험 표준약관상 대차료 지급기준을 4분기 중 명확하게 할 예정이라고 밝혔다.",https://n.news.naver.com/mnews/article/016/0002046935?sid=101
자동차보험 렌트비 산정시 친환경차ㆍSUV 반영된다,2022-09-29 12:01:30,연합뉴스,"고출력 전기차 기준 신설…SUV는 별도 기준 대차료 산정금감원 대차료 지급기준 개선…10월 11일부터 시행    금융감독원[연합뉴스TV 제공](서울=연합뉴스) 이지헌 기자 = 교통사고 피해 시 보험사에서 받을 수 있는 대차료(렌트비) 산정 기준이 친환경차량 및 스포츠유틸리티(SUV) 차량 보급 확대를 반영해 합리화된다.    금융감독원은 엔진 배기량을 주로 고려하는 현행 내연기관 세단 차량 중심의 자동차보험 대차료 지급 기준을 친환경차 보급과 SUV 선호 현상 등 자동차 환경 변화에 맞춰 개선해 다음달 11일부터 시행한다고 29일 밝혔다.    대차료란 자동차 사고 시 수리기간 다른 자동차를 렌트하는 비용을 말한다. 보험사는 약관에 따라 배기량과 연식이 유사한 동급 차량의 대여자동차 중 최저 요금을 대차료 기준으로 삼는다.    우선 전기차 대차기준에 내연기관의 초대형(배기량 3.5ℓ 수준) 차량 기준에 해당하는 구간을 신설하기로 했다.    포르쉐 타이칸(390∼560㎾), BMW i4 M(400㎾), 아우디 e-트론GT( 390㎾), 테슬라 모델X(500∼895㎾), 테슬라 모델(500∼895㎾) 등 배터리 출력이 390㎾ 이상 차량이 이 구간에 해당한다.    이전에는 이들 차량 사고 시에도 대차료 지급 한도가 그랜져·K7 2.2ℓ 등급 에 그쳤다.    전기차 대차료 인정기준 예시[금융감독원 제공]    하이브리드 차량은 추가된 배터리 용량을 고려, 동일 모델의 내연기관 차량 기준으로 대차료를 산정하도록 했다.    싼타페 1.6ℓ 하이브리드 차주가 사고 시 기존에는 동일 배기량 세단인 아반떼 1.6ℓ 기준으로 대차료를 받았다면 앞으로는 싼타페 2.2ℓ 기준의 대차료를 받을 수 있게 된다는 의미다.    다운사이징 엔진 차량은 동일 모델의 일반엔진 차량 기준으로 대차료를 산정 받을 수 있게 했다.    다운사이징 엔진이란 배출가스 규제 등을 만족하기 위해 출력은 유지하되 배기량을 줄인 고효율 엔진을 말한다.    다운사이징 엔진을 탑재한 K5 1.6ℓ 차주는 사고 시 아반떼 1.6ℓ 대신 K5 2.0ℓ 기준 대차료를 받을 수 있게 된다.    SUV는세단이 아닌 동급 세단이 아닌 동급 SUV 기준 최저 대여요금을 한도로 대차료를 지급받을 수 있게 된다.    SUV인 코나 1.6ℓ 차주는 아반떼 1.6ℓ 기준 대차료(하루 7만원)를 받았지만 앞으로는 코나 1.6ℓ 기준의 대차료(하루 11만원)를 받을 수 있다.    자동차보험 렌트비 산정시 친환경차ㆍSUV 반영된다(CG)[연합뉴스TV 제공]    금감원은 개선된 산정 기준을 12개 자동차보험사의 대차료 관련 실무 보상지침에 반영토록 할 방침이다.    친환경차 등 일부 차량의 경우 대차료 산정 시 배기량뿐만 아니라 차량 성능을 제대로 반영할 수 있도록 4분기 중 자동차보험 표준약관상 대차료 지급기준을 명확히 할 예정이다.    금감원은 대차료 개선방안을 반영한 질의응답 자료를 금감원 홈페이지 자주하는질문(FAQ) 게시판에 공개할 예정이다.    금감원은 ""친환경 차량 및 SUV 차량에 대한 합리적인 대차료 지급기준 마련으로 해당 차량을 소유한 소비자의 권익이 크게 개선될 것으로 예상한다""고 말했다.    pan@yna.co.kr",https://n.news.naver.com/mnews/article/001/0013471627?sid=101
"""테슬라 모델S 타다 사고나면 제네시스 G80으로 대차""",2022-09-29 12:00:00,뉴스1,"금감원, 자동차보험 대차료 지급기준 개선    자동차보험 대차료 지급기준 개선표. (금융감독원 제공)(서울=뉴스1) 신병남 기자 = 배터리 출력 390kw 이상 고출력 전기차들도 앞으로는 차량 사고로 다른 차량을 빌릴 때 출력 규모에 맞는 초대형 내연기관 차량의 대차료가 지급된다. 금융감독원은 오는 10월11일부터 친환경차량, SUV 등 새로운 유형 차량에 맞는 대차료 지급기준을 마련해 보험사 보상 실무지침에 반영한다고 29일 밝혔다.전기차의 경우 배터리 출력 390kw 이상 구간 신설이 신설되며 하이브리드·다운사이징 엔진·SUV 차량은 각각의 출력에 맞는 대차료 산정 체계가 새롭게 적용된다.우선 전기차의 경우 배터리 출력이 390kw 이상인 차량은 배기량 3500cc 수준 내연기관의 초대형 기준으로 대차료가 산정된다. 이에 따라 테슬라 모델 S·X, 포르쉐 타이칸, BMW i4 M, 아우디 e-트론GT은 제네시스 G80 3.3, K9 3.3 등을 보험비로 대차받을 수 있게 됐다.하이브리드 차량은 추가된 배터리 용량을 감안해 동일모델의 내연기관 차량 기준으로 대차료 산정 기준이 고쳐진다. 예컨대 배기량이 1598cc에 배터리가 44.2Kw 추가된 차량의 경우 배기량이 2000cc인 내연기관 차량으로 대차료가 산정되는 형태다.  다운사이징 엔진 차량은 동일 모델의 일반엔진 차량과 성능(엔진출력, 차량크기 등)이 유사한 점 등이 감안돼 일반엔진 장착 차량을 기준으로 대차료 산정 기준이 바뀐다. 다운사이징 차량은 배기량을 줄이면서 출력을 높이는 고효율 엔진이 장착돼 있다. 하지만 보험사들은 사고차량의 배기량만을 기준으로 해 대차료를 지급해왔다.SUV 차량에 대해서도 일반 세단차량이 아닌 동급의 SUV 차량의 최저 대여요금을 한도로 대차료가 지급하도록 개선된다. SUV의 경우 세단 차량보다 대차료가 더 비싼데도 세단 차량의 배기량 기준으로 대차료가 책정되면서 소비자 편익이 떨어지는 경우가 발생했다.금감원 관계자는 ""친환경차 등 일부 차량의 경우 대차료 산정시 배기량 뿐만 아니라 차량의 성능을 제대로 반영할 수 있도록 할 계획""이라며 ""4분기 중에는 자동차보험 표준약관상 대차료 지급기준을 명확하게 할 수 있을 것""이라고 말했다.",https://n.news.naver.com/mnews/article/421/0006363879?sid=101
전기차·SUV 대차료 '제값' 받는다…車보험 지급기준 개선안 시행,2022-09-29 12:00:00,뉴시스,"기사내용 요약'동급 배기량의 내연기관 세단' 기준 대차료 지급기준 개선고출력 전기차 기준 마련…SUV는 세단 아닌 동급 SUV로하이브르드 배터리 용량, 다운사이징 엔진 출력도 고려    [서울=뉴시스] 김금보 기자 = 환경부가 30일 전기·수소차 의무운행 기간을 최대 5년으로 늘리는 대기환경보전법 시행규칙 개정안을 공포했다. 사진은 이날 오전 서울 중구 한 전기차충전소. 2022.06.30. kgb@newsis.com[서울=뉴시스] 김형섭 기자 = 자동차 사고로 인한 수리 기간 중 지급되는 '대차료'와 관련해 전기차 같은 친환경차나 스포츠유틸리티차량(SUV)도 제값을 받을 수 있게 됐다. 엔진 배기량을 따져 내연기관 세단 차량 기준으로 보험사가 주던 자동차보험 대차료 지급기준이 개선되는 데 따른 것이다.금융감독원은 29일 친환경차와 SUV 등에 대한 현행 자동차보험 대차료 지급기준을 개선한다고 밝혔다.대차료란 자동차 수리기간 동안 다른 자동차를 렌트하는 차주에게 보험사가 지급하는 비용이다. 현행 자동차보험 대차료 지급기준은 배기량과 연식이 유사한 내연기관 세단 차량 중심으로 대차료를 지급토록 설계돼 있어 친환경차와 SUV 소유주들의 불만이 많았다.금감원이 소개한 실제 사례를 보면 테슬라 SUV 전기차인 모델X 소유주인 A씨는 자동차 사고로 같은 SUV인 모하비 3.0 차량을 대차받았지만 보험사는 그랜저 2.4를 기준으로 삼아 대차료를 낮게 지급했다.SUV 차량인 코나 1.6 차주인 B씨는 쏘나타 2.0 차량을 대차받았지만 보험사는 세단 차량 중 동일한 배기량인 아반떼 1.6 기준으로 대차료를 지급하기도 했다.금감원은 친환경차와 SUV 비중이 급속히 높아지고 있는 점을 감안해 대차료가 합리적으로 지급될 수 있도록 전기차, 하이브리드, 다운사이징, SUV 등 4가지 유형의 차량별 특성을 반영한 대차료 지급기준을 마련해 보험사 보상 실무지침에 반영키로 했다.이에 따라 고출력 차량에 대한 기준이 없던 전기차는 배터리 출력이 '390㎾ 이상'인 경우 초대형 내연기관 차량인 배기량 3500㏄ 기준으로 대차료를 산정토록 했다.배터리 고려 없이 배기량만 기준으로 삼았던 하이브리드 차량은 추가된 배터리 용량을 감안해 동일 모델의 내연기관 차량 기준으로 대차료를 산정하게 바뀐다. 배기량 1598㏄에 배터리 용량이 44.2㎾인 하이브리드 차량이라면 배기량 2000㏄ 내연기관 차량의 대차료를 지급하는 식이다.기존 엔진의 배기량을 줄이면서 출력을 높인 고효율 엔진을 단 다운사이징 엔진 차량의 경우 동일 모델의 일반엔진 장착 차량을 기준으로 대차료를 산정하게 된다. 일례로 K5 1.6 다운사이징 엔진 장착 차량이라도 K5 2.0 일반 엔진 차량과 동일한 대차료를 받을 수 있다는 의미다.그동안 동급의 세단 차량을 기준으로 대차료가 지급되던 SUV는 세단이 아닌 동급의 SUV 차량의 최저 대여요금을 한도로 대차료를 지급토록 바뀐다.금감원은 자동차보험을 판매하는 12개 전 보험사의 대차료 관련 실무 보상지침에 이번 개선안을 반영해 오는 10월11일부터 시행할 예정이다.또 하이브리드와 다운사이징 엔진 장착 차량의 대차료 산정시 차량 성능이 제대로 반영되도록 4분기 중 자동차보험 표준약관상 대차료 지급 기준을 변경한다.    [서울=뉴시스]친환경차 및 SUV의 자동차보험 대차료 지급기준 개선안. (자료=금감원 제공) *재판매 및 DB 금지",https://n.news.naver.com/mnews/article/003/0011447805?sid=101
