"삼성, 잼버리 추가지원 결정…신입사원 파견하고 사업장 견학",2023-08-06 14:05:07,디지털타임스,"삼성은 제25회 세계스카우트잼버리(잼버리)의 원활한 운영을 위해 오는 7일부터 임직원 150명을 투입하고 삼성전자 사업장 견학 프로그램을 가동하기로 하는 등 추가 지원을 한다고 6일 밝혔다.앞서 삼성은 지난 주말 삼성병원의 의료지원단을 잼버리 현장에 파견하고 간이 화장실 및 전동 카트 지원, 건강 음료 제공 등 지원을 진행한 바 있다.이번 추가 지원에 따라 삼성은 입사 후 연수를 받고 있는 신입사원 150여명을 7일부터 현장에 파견할 계획이다. 삼성 임직원들은 현장에서 쓰레기 분리수거 등 자원봉사자들의 환경미화 활동을 도울 예정이다.삼성은 신입사원들이 입사 후 회사 생활에서 사회적 책임을 느끼고 실천할 수 있도록 기존부터 신입사원 입문 교육에 봉사활동 프로그램을 포함시켜 왔다. 이번 잼버리 파견 역시 업무를 먼저 배우기보다 사회와 같이 나누고 함께 성장하는 것이 세계 최고를 향한 길이라는 삼성의 '동행' 비전을 신입사원들에게 체득시키기 위해 결정했다는 게 회사 측 설명이다.아울러 삼성전자는 잼버리에 참가 중인 학생들을 대상으로 '오픈 캠퍼스' 사업장 견학 프로그램도 운영하기로 했다. 삼성전자는 평택 또는 화성 반도체공장, 수원 삼성이노베이션 뮤지엄(SIM) 견학 프로그램을 스카우트 학생들에게 제공해 글로벌 미래 인재들이 한국의 첨단IT 산업을 체험할 수 있도록 할 계획이며, 하루 550여명의 스카우트 대원들이 참여 가능할 것으로 전망된다.앞서 삼성은 잼버리 참가자들의 건강 관리를 돕기 위한 이온음료와 비타민음료 각 10만개씩 총 20만개를 대한적십자사를 통해 제공했으며, 현장에 의료지원단을 파견하기로 결정한 바 있다. 삼성서울병원 의사 5명, 간호사 4명, 지원인력 2명 등 총11명으로 구성된 의료지원단은 지난 5일 오후 현장에 도착해 즉시 진료 활동을 진행했다.잼버리 참가자 대부분이 청소년인 점을 고려해 삼성 의료지원단에는 소아청소년과 전문의 등 소아전문 인력이 포함됐으며, 응급의약품이 구비된 진료버스 1대와 구급차 1대도 함께 지원했다. 삼성 의료지원단은 참가자들이 건강하게 잼버리 활동을 마칠 수 있도록 행사가 끝나는 12일까지 의료 봉사를 계속할 예정이다.아울러 삼성물산은 잼버리 운영 인력들이 현장 내에서 원활하게 이동할 수 있도록 산하 골프장을 통해 전동 카트 11대와 전기차 2대를 지원했다. 세계스카우트잼버리가 열리고 있는 새만금 일대 행사장은 면적이   매우 넓어 골프장용 전동 카트가 유용하게 활용될 전망이다.또 삼성물산이 지원한 에어컨 장착 간이 화장실 7세트, 살수차 5대, 발전기 5대도 5일 현장에 설치돼 곧바로 가동을 시작한 바 있다.삼성은 그동안 도움이 필요한 국내외 현장에 성금과 물품을 기부하고, 복구 활동에 나서는 등 지원에 적극적으로 동참해 왔다.     제25회 세계스카우트잼버리 지원을 위해 현장 파견된 삼성 의료지원단 관계자가 현장에서 진료 활동을 하고 있다. 삼성 제공",https://n.news.naver.com/mnews/article/029/0002817835?sid=101
기대했던 車보험료 인하 힘들어지나 [이슈 속으로],2023-08-06 14:03:05,세계일보,"손보사 손해율 상반기 소폭 늘어 82.5%하반기 침수車 보상 반영 땐 ‘악화’ 예상올해 상반기 손해보험사들의 자동차보험 손해율이 소폭 악화된 것으로 나타났다. 코로나19 방역 완화로 대면 활동이 늘어나며 자동차보험 보상도 늘어났다는 풀이다. 집중호우, 태풍 등 영향으로 차량 손해 보상이 늘어나면 손해율은 더 악화할 것이란 전망이다.  5일 손해보험업계에 따르면 올해 상반기 손해보험사 11곳의 자동차보험 손해율은 82.5%로 전년 동기(80.7%) 대비 1.8% 상승한 것으로 나타났다.         사진=게티이미지뱅크 제공    자동차보험에서 손해율이란 사고보상금의 합계를 보험사가 거둬들인 보험료의 합계로 나눈 비율이다. 손해율이 낮을수록 보험사가 이익을 많이 남겼다고 볼 수 있다. 손보업계에서는 사업운영비를 고려할 때 자동차보험의 손익분기점에 해당하는 손해율을 일반적으로 80%대로 보고 있다.  방역 완화 조치 이후 나들이 등 외부 활동이 증가함에 따라 차량 사고 등으로 인한 보상금이 늘어났다는 분석이다. 손보업계 관계자는 “코로나19 이후 대면 활동이 증가하면서 전체 손해율이 소폭 상승한 것으로 보인다”며 “6월 말 집중호우 관련 보상도 포함돼 일부 영향이 있었던 것으로 판단된다”고 설명했다.  중·대형 손보사와 소형 손보사의 성적이 엇갈렸다. 전체 자동차보험 시장 점유율의 85% 이상을 차지하는 것으로 알려진 4개사(삼성화재, 현대해상, KB손해보험, DB손해보험)의 평균 손해율은 77.7%로 전체 평균을 밑돌았다. 전년 동기(76.6%) 대비로는 1.1% 소폭 상승했다. 반면 소형사 4곳(흥국화재, MG손해보험, AXA손해보험, 하나손해보험)의 손해율은 평균 89.8%에 달했다. 소형사의 경우 가격 경쟁력을 앞세우다 보니 같은 보상금이라도 손해율이 높게 나올 수밖에 없다는 설명이다.        하반기 자동차보험의 손해율이 상반기보다 높게 나오는 점을 고려했을 때, 올해 손해율은 지난해보다 높게 나올 것으로 예상된다. 일반적으로 하반기에는 장마철 집중호우와 태풍 피해 등으로 인한 침수 차량 피해가 늘어나며 보상금이 늘어나는 경향을 보이기 때문이다. 지난해에는 8월 중부 지방 집중호우와 9월 태풍 힌남노 피해로 인한 보상금이 1593억원을 기록해 손해율이 80%대 중반까지 치솟기도 했다. 이에 주요 손보사들은 7월 집중호우와 8월 이후 태풍 피해로 인한 손해율 예측치를 산출하는 등 사전 대응에 들어간 것으로 알려졌다.  이에 당초 기대를 모았던 자동차보험료 인하 여부에도 변수가 생겼다. 손해율이 높아지면 손보업계는 비용 증가 등의 이유로 이듬해 자동차보험료 인상을 고려하게 된다. 손보업계가 올해 1분기 호실적을 기록하고 금융 당국의 상생 기조에 호응하며 보험료를 인하할 가능성도 제기됐으나 업계에서는 하반기 손해율 상승 등을 고려해야 한다는 입장이다.         경기 과천시 서울대공원 주차장에 수도권 침수차량들이 모여있는 모습. 뉴시스    손보업계 관계자는 “상반기 실적에는 7월 집중호우 등의 요인이 반영되지 않아 추가로 (손해율이) 상승할 요인이 있다”며 “지난해에도 9월 태풍으로 인한 침수 피해 영향이 컸는데, 올해도 가능성을 고려해야 한다”고 설명했다.",https://n.news.naver.com/mnews/article/022/0003841989?sid=101
"삼성카드, CB업 본허가 신청...카드사 신용평가업 경쟁 합류",2023-08-06 14:02:01,전자신문,"삼성카드삼성카드가 개인사업자신용평가업(CB)에 도전한다. 연내 자격을 획득하고 사업에 나설 계획이다.금융당국에 따르면 삼성카드는 최근 금융위원회에 개인사업자신용평가업(CB) 본허가를 신청했다. 삼성카드 관계자는 “카드사가 보유한 가맹점주 정보 외에도 다양한 사업자 데이터를 확보, 활용해 개인사업자에 대한 신용평가 변별력을 개선하고 관련 사업을 지속 확대할 계획”이라고 말했다.개인사업자신용평가업은 카드사 새 먹거리 중 하나로 꼽힌다. 특히 자영업자 대출시장에 판도 변화를 불러올 수 있다. 예를 들어 CB가 만든 신용평가시스템에 마이데이터를 결합하면 개인사업자 전용 맞춤 대출서비스 추천 등 초개인화 비즈니스가 가능해진다.앞서 신한카드와 KB국민카드, 비씨카드가 개인사업자 CB업 본허가를 받았다.삼성카드는 데이터 경쟁력을 강화하기 위한 준비를 마친 상태다. 지난달 열린 이사회에서 금융 통합플랫폼 모니모 운영을 위한 삼성생명, 삼성화재, 삼성증권 등 계열사 분담비용을 총 864억7400만원으로 책정하는 등 지난해에 비해 지원 규모를 크게 늘렸다.카드 업계 관계자는 “주요 사업자인 삼성카드의 합류로 CB 비즈니스 경쟁이 활성화 될 것”이라고 말했다.",https://n.news.naver.com/mnews/article/030/0003123416?sid=101
"법무부, '광복절 특별사면' 심사위 오는 9일 개최",2023-08-06 14:02:24,YTN,"8월 15일 광복절 특별사면 대상자를 가리기 위한 사전 심사가 9일 열립니다.법무부는 오는 9일 오전 정부과천청사에서 사면심사위원회를 열고 광복절 특사와 복권 요청 대상자를 심사합니다.위원회에는 위원장인 한동훈 장관을 비롯해 이노공 차관, 신자용 검찰국장과 교수·변호사 등 위촉직 위원 등 9명이 참여하고, 특사·복권 대상자를 선정해 사면권자인 윤석열 대통령에게 보고합니다.이번 광복절 특사에는 이중근 부영그룹 창업주, 이호진 전 태광그룹 회장을 비롯한 재계 총수와 박근혜 정부 국정농단 사태에 연루된 최지성 전 삼성전자 미래전략실장, 장충기 전 차장 등 재계 인사가 포함될 거란 전망이 나옵니다.정치권에서는 마찬가지로 국정농단 사건과 관련해 실형이 확정된 안종범 전 청와대 정책조정수석과 홍완선 전 국민연금 기금운용본부장 등이 거론되고 있습니다.※ '당신의 제보가 뉴스가 됩니다'[카카오톡] YTN 검색해 채널 추가[전화] 02-398-8585[메일]",https://n.news.naver.com/mnews/article/052/0001919591?sid=102
"삼성전자, 스마트폰 제일 많이 팔았지만...번 돈은 애플의 7분의 1",2023-08-06 14:01:03,한국일보,"카운터포인트리서치 분석    삼성전자 갤럭시 폴더블폰 Z플립5(왼쪽)와 Z폴드5(오른쪽) 사전예약 첫날인 1일 서울 영등포구 더현대서울 삼성스토어에서 사전예약 희망자들이 신제품을 체험해보고 있다. 뉴시스삼성전자가 2분기(4~6월) 세계 스마트폰 시장 점유율 1위 자리를 지켰다. 그러나 스마트폰 매출과 영업이익은 애플이 삼성전자를 압도했다. 특히 영업이익의 경우 삼성전자보다 7배나 많이 남긴 것으로 나타났다.5일(현지시간) 시장조사업체 카운터포인트리서치에 따르면 삼성전자는 2분기 세계 스마트폰 출하량 점유율 20%를 기록해 22%였던 1분기에 이어 선두를 유지했다. 1분기 21%였던 2위 애플은 17%로 떨어지면서 삼성전자와 격차도 3%포인트로 벌어졌다. 그러나 영업이익 점유율은 애플이 삼성전자를 크게 앞섰다. 애플은 2분기 세계 스마트폰 업체들이 벌어들인 영업이익 중 무려 85%를 차지했다. 전 분기 84%보다는 1%포인트, 지난해 2분기에 비하면 4%포인트 높아진 것이다. 반면 삼성전자의 2분기 영업이익 점유율은 12%였다. 애플과의 격차는 73%포인트로 시장에 출하한 스마트폰 대수는 많았음에도 영업이익은 애플의 7분의 1 수준에 그쳤다. 갤럭시Z플립5·폴더5 얼마나 선전할지 관심    2분기 세계 스마트폰 시장에서 애플의 영업이익 점유율이 85%를 기록했다. 카운터포인트리서치 자료 캡처애플의 영업이익 점유율이 더 높아진 건 평균판매단가(ASP)가 올라갔기 때문이다. 제프 필드핵 카운터포인트리서치 디렉터는 ①아이폰 시리즈 중 고가에 속하는 '프로' 모델 판매 비중이 커지고 ②아이폰13 시리즈에 있던 '미니' 모델이 아이폰14 시리즈에선 없어진 대신 비싼 '플러스' 모델이 추가된 것 등이 ASP 상승을 이끌었다고 분석했다.애플은 2분기 매출 점유율 역시 45%로 1위를 수성했다. 삼성전자 점유율은 애플보다 28%포인트 낮은 17%였다. 삼성전자가 하반기 전략 제품인 갤럭시Z플립5·폴드5를 지난달 공개한 만큼 3분기에도 스마트폰 출하량 1위를 이어갈 가능성이 크다. 폴더블폰은 삼성전자 스마트폰 가운데 최고가여서 ASP 상승에도 보탬이 될 전망이다. 갤럭시Z플립5·폴드5와 경쟁할 애플 아이폰15 시리즈는 9월 공개 예정이다. 아이폰 시리즈 중 처음으로 USB-C타입 충전단자가 적용될 것이란 전망이 나온다.",https://n.news.naver.com/mnews/article/469/0000753636?sid=105
"법무부, '광복절 특사' 세 번째 심사위 연다…국정농단 관련자들 꼽혀",2023-08-06 14:01:01,서울경제,"재계 최지성·장충기, 정치권 안종범·김종·홍완선 등 예상    최지성 전 삼성 미래전략실장이 지난해 3월 24일 오전 서울 서초구 서울중앙지방법원에서 열린 회계부정·부당합병 관련 1심 속행 공판에 출석하고 있다. 연합뉴스[서울경제] 윤석열 정부의 세 번째 특별사면 대상자 사전 심사가 오는 9일 열린다. 이번 특사에는 박근혜 정부 국정농단 사건에 연루된 경제인들이 포함될 것이란 관측이 나온다.6일 법조계에 따르면 법무부는 9일 정부과천청사에서 사면심사위원회를 열고 광복절 특별사면 및 복권 요청 대상자를 심사할 계획이다. 사면심사위는 이노공 차관, 신자용 검찰국장, 김선화 대검찰청 공판송무부장 등 당연직 4명과 교수·변호사 등 위촉직 위원 5명 등 총 9명으로 구성된다. 위원장은 한동훈 법무부 장관이다. 사면심사위는 특사·복권 건의 대상자를 선정하고, 사면권자인 윤 대통령에게 보고한다.이번 특사 대상은 경제인이 주를 이룰 것이라는 관측이 나온다. 2016년 박근혜 정부 국정농단 사태에 연루된 최지성 전 삼성전자 미래전략실장·장충기 전 미래전략실 차장이 대상으로 꼽힌다. 이들은 박 전 대통령과 최서원(개명 전 최순실) 씨에게 뇌물을 제공한 혐의로 2021년 대법원에서 각각 징역 2년 6개월을 확정 받았다가 지난해 3월 가석방됐다. 재계 총수로는 이중근 부영그룹 창업주, 박찬구 금호석유화학그룹 회장, 이호진 전 태광그룹 회장 등이 꾸준히 이름이 오르내린다. 정치권에서는 안종범 전 청와대 정책조정수석과 김종 전 문화체육관광부 2차관, 홍완선 전 국민연금 기금운용본부장 등이 사면대상자로 거론된다.",https://n.news.naver.com/mnews/article/011/0004223007?sid=102
"삼성·LG전자, '성장중' 전장 시장 선점…8월 독일 모터쇼 나란히 첫 참가",2023-08-06 13:59:01,노컷뉴스,"삼성 ""차량용 리더십 강화""…LG ""올해 전장 수주잔고 100조원 목표""    IAA 모빌리티. IAA 모빌리티 홈페이지 캡처삼성전자와 LG전자가 다음 달 5~10일 독일 뮌헨에서 열리는 국제 모터쇼 'IAA 모빌리티 2023'에 나란히 첫 참가하며 '미래 먹거리'인 전장(자동차 전기·전자 장비) 시장 선점에 드라이브를 건다.전기차·자율주행차 등 미래 모빌리티 성장에 따라 양사의 전장 사업은 실적기 개선되며 본궤도에 오른 상태다. 양사 모두 이를 기점으로 관련 사업 경쟁력 강화에 집중하고 있다.전장 시장 연평균 14% 껑충…삼성·LG, 모터쇼 나란히 첫 참가6일 업계에 따르면 글로벌 전장 산업의 시장 규모는 오는 2029년까지 연평균 14% 성장할 전망이다. 전기차 시장이 급성장하며 반도체와 카메라, 센서, 통신, 디스플레이 등 고가의 전장 부품가 늘고 있어서다. 2017년 스마트폰 부품 시장 대비 70% 수준이었던 전장 산업 규모는 올해 스마트폰 부품 시장을 넘어설 것으로 전망된다.이에 삼성전자와 LG전자는 나란히 IAA 모빌리티에 처음 참가하며 전장 사업 강화에 가속 페달을 밟고 있다.  IAA 모빌리티는 세계 4대 모터쇼 중 하나로, 글로벌 자동차 제조 업체와 공급 업체 등이 모여 최신 혁신 기술을 공개하고 모빌리티의 미래를 설계하는 자리다.삼성전자는 반도체를 담당하는 디바이스솔루션(DS) 부문이 삼성디스플레이, 삼성SDI와 함께 IAA 모빌리티에 참가한다.LG전자는 스폰서 자격으로 IAA 모빌리티에 참가한다. LG전자는 개막 전날인 다음 달 4일 프레스 콘퍼런스를 열고 모빌리티에 대한 미래 비전을 공개할 예정이다.'삼성 전장·오디오 자회사' 하만 꾸준한 성장세…""車반도체 시장 강화""    삼성전자 CES 2023 부스에서 '하만 레디 케어'에 박수 보내는 올리버 집세 BMW 회장. 연합뉴스삼성전자의 전장·오디오 자회사 하만은 꾸준한 성장세를 보이고 있다. 올해 2분기 매출 3조5천억원, 영업이익 2500억원을 보였는데 작년 2분기와 비교하면 매출은 17.4%, 영업이익은 150% 각각 늘었다.하만은 작년에도 연간 매출 13조2100억원, 영업이익 8800억원으로 역대 최대 실적을 기록한 바 있다. 차량용 인포테인먼트(IVI) 시스템을 하이엔드(고사양) 차량 중심으로 확대해 온데 따른 것이다.하만은 디지털콕핏(디지털화된 자동차 운전공간)과 카오디오 중심으로 수주 확대를 꾀할 방침이다. 특히 삼성전자의 소프트웨어(SW) 등 정보통신(IT) 기술 역량과 접목해 차량 기능 연동과 외부 디바이스 확장 등 차량 내 탑승자 경험(ICX) 분야의 핵심 역량에서 시너지를 낸다는 복안이다.삼성전자는 이와 함께 차량용 반도체 시장이 2030년 이후 서버, 모바일과 함께 3대 응용처가 될 것으로 보고 차량용 반도체 시장을 적극 공략할 계획이다. 차량용 메모리 시장은 향후 5년간 평균 30% 중후반의 성장을 보일 것으로 전망된다.이와 관련해 삼성전자는 지난 6월 현대차와 차량용 인포테인먼트 분야에서 처음으로 손을 잡는다고 발표했다. 2025년 현대자동차의 차량에 프리미엄 인포테인먼트용 프로세서인 '엑시노스 오토 V920'을 공급하는 것이 목표다.    삼성전자 엑시노스 오토 V920. 삼성전자 제공최근에는 기존 제품 대비 소비전력을 33% 개선한 차량용 인포테인먼트 유니버설 플래시 스토리지(UFS) 3.1 메모리 솔루션 양산을 시작했다. 첨단운전자지원시스템(ADAS)용 UFS 3.1 제품으로 고객사와 자동차 인증기관으로부터 오토모티브 스파이스(ASPICE) CL2 인증도 받았다.삼성전자 메모리사업부 김재준 부사장은 지난 2분기 실적 콘퍼런스콜에서 ""제품 안정성과 소비 전력 등 차량용 시장의 차별화된 제품을 기반으로 업계 최고 수준의 풀 라인업을 구축했다""며 ""앞으로도 경쟁력 있는 제품을 기반으로 고객사와 협업하며 차량용 시장에서의 리더십을 강화하겠다""고 밝혔다.LG전자 ""올해 말 전장 수주잔고 100조원 목표""    LG마그나 이파워트레인의 전기차 파워트레인 컨셉 사진. LG전자 제공LG전자 전장사업도 꾸준한 성장세다. △차량용 인포테인먼트 시스템(VS사업본부) △전기차 파워트레인(LG마그나 이파워트레인) △차량용 조명 시스템(ZKW) 등 3개 사업의 10년간 연평균 성장률은 30% 수준이다.올해 2분기의 경우 제너럴모터스(GM)의 쉐보레 볼트 EV 리콜 재료비 상승분 1510억원이 반영된 탓에 전장(VS)사업본부는 영업손실 612억원을 기록했지만 이를 제외하고 보면 VS사업본부의 2분기 매출은 2조6645억원, 영업이익은 898억원으로 2분기 기준 역대 최대치를 기록했다.LG전자는올해 말  전장 수주 잔고 목표를 100조원으로 잡고 있다.LG전자는 기존 사업은 물론 차량 전동화와 커넥티드 서비스 등 트렌드에 대응해 자율주행과 소프트웨어(SW) 솔루션, 콘텐츠 등 미래 모빌리티에서 시뉴 사업 기회도 모색한다는 복안이다.LG전자 조주완 사장은 간담회에서 ""자동차가 이동 수단에서 새로운 경험 공간으로 진화하면서 다양한 목적에 맞는 공간으로 변화하고 있다""며 ""VS사업본부는 미래 자동차 트렌드에 적극 대응하고 B2C(기업과 소비자 간 거래) 사업에서 확보한 고객 인사이트를 활용해 2030년까지 매출 약 20조원 이상 규모로, 미래 모빌리티 시장에서 글로벌 톱 수준 회사로 성장할 것""이라고 밝혔다.자동차 부품업체 마그나와 합작 설립한 LG마그나 이파워트레인은 오는 9월부터 멕시코 신규 공장을 가동할 예정이며, 유럽 권역 대응을 위한 신규 공장 설립도 준비하고 있다.※CBS노컷뉴스는 여러분의 제보로 함께 세상을 바꿉니다. 각종 비리와 부당대우, 사건사고와 미담 등 모든 얘깃거리를 알려주세요.이메일 :",https://n.news.naver.com/mnews/article/079/0003798851?sid=101
오는 9일 '광복절 특사' 심사 개최..국정농단 관련 경제인들 거론,2023-08-06 13:56:01,kbc광주방송,"▲ 서울구치소 나서는 최지성·장충기 사진 : 연합뉴스 윤석열 정부 들어 세 번째 특별사면 대상자를 가리기 위한 사전 심사가 오늘 9일 개최됩니다. 법무부가 오는 9일 오전 정부과천청사에서 사면심사위원회를 열고 광복절 특별사면 및 복권 요청 대상자를 심사할 예정인 가운데 이번에는 경제인이 주를 이룰 것이란 관측이 나오고 있습니다. 지난 신년 특별사면에 이명박 전 대통령, 김경수 전 경남지사, 김기춘 전 대통령 비서실장 등 정치인들이 주로 이름을 올렸기 때문입니다. 이에 따라 2016년 박근혜 정부 국정농단 사태에 연루된 최지성(72) 전 삼성전자 미래전략실장, 장충기(69) 전 미래전략실 차장의 특별사면이 거론되고 있습니다. 이들은 박 전 대통령과 최서원(개명 전 최순실)씨에게 뇌물을 제공한 혐의로 2021년 대법원에서 각각 징역 2년 6개월을 확정받았다가 지난해 3월 가석방됐습니다. 이밖에도 이중근 부영그룹 회장, 박찬구 금호석유화학그룹 회장, 이호진 전 태광그룹 회장 등도 재계 안팎에서 꾸준히 이름이 오르내리는 특별사면 대상자입니다.     ▲ 안종범 전 청와대 정책수석 징역 4년 확정 사진 : 연합뉴스 정치권에서는 안종범(64) 전 청와대 정책조정수석과 김종(62) 전 문화체육관광부 2차관, 홍완선(67) 전 국민연금 기금운용본부장 등이 사면대상자로 거론되고 있습니다. 사면심사위는 위원장인 한동훈 장관을 비롯한 당연직 4명과 교수·변호사 등 위촉직 위원 5명 등 9명으로 구성됩니다. 사면심사위는 특사·복권 건의 대상자를 선정해 사면권자인 윤 대통령에게 보고합니다.#광복절 #국정논단 #특별사면",https://n.news.naver.com/mnews/article/660/0000041793?sid=100
삼성생명 `연대-삼성 금융리더 5기` 53명 수료,2023-08-06 13:55:08,디지털타임스,"지난 4일 서울 서대문구 연세대학교에서 열린 '연대-삼성 금융리더 5기' 수료식에서 전영묵(앞줄 왼쪽 일곱번째) 삼성생명 대표가 수료 컨설턴트들과 기념촬영을 하고있다. 사진 제공=삼성생명    삼성생명은 산학연계 과정인 '연대-삼성 금융리더' 5기 컨설턴트 53명에 대한 수료식을 개최했다고 6일 밝혔다.지난 4일 서울 서대문구 연세대학교에서 열린 행사에는 5기 컨설턴트 53명, 김동훈 연세대 부총장, 전영묵 삼성생명 대표, 반기봉 FC영업본부장, 이문화 전략영업본부장 등이 참석했다.2017년 개설된 '연대-삼성 금융리더'는 컨설턴트의 만족도가 가장 높은 삼성생명의 대표 산학연계 과정이다. 영업 경력 만 3년 이상의 우수 컨설턴트를 대상으로 하며 매 기수마다 약 50여명을 선발한다. 지금까지 총 200여명의 수료생을 배출했다.연대-삼성 금융리더 과정은 경제, 세무, 리더십, 인문학, 의학 등 다양한 커리큘럼으로 8주간 진행됐다. 특히 이번 5기는 보험업계 최초로 연세의료원 중입자치료센터를 견학하는 시간도 가졌다.전영묵 삼성생명 대표는 ""이번 과정은 고객에게 한층 더 수준 높은 금융서비스를 제공할 수 있도록 하는 자양분이 될 것""이라며 ""앞으로도 고객과 함께하는 최고의 금융 전문가로 활동해 달라""고 말했다.",https://n.news.naver.com/mnews/article/029/0002817833?sid=101
