
갤Z플립·폴드5 돌풍…사전판매 전작의 2배,2023-08-01 17:37:01,매일경제,"첫날 자정부터 대거 몰려10명 중 7명 플립 선택판매 100만대 돌파 주목공시지원 최대 65만원 달해플립 '2년 무제한' 月13만원    삼성전자가 출시한 새 폴더블폰인 갤럭시Z 플립5·폴드5가 사전판매 시작일인 1일부터 전작 대비 2배에 달하는 판매량을 기록했다.출고가와 공시지원금을 감안하면 플립5는 전작 대비 5만원, 폴드5는 전작 대비 30만원이나 비싼 가격인데도 불구하고 판매량이 대폭 늘어난 것이다. 2030 MZ세대 사이에서 아이폰 선호가 뚜렷한 가운데 삼성전자 폴더블폰이 2030세대에게 얼마나 어필할 수 있을지 관심이 집중된다.1일 삼성전자에 따르면 삼성전자가 이날 플립5·폴드5 사전판매를 시작하면서 자정부터 새벽 1시 40분까지 '삼성닷컴'에서 사전판매 라이브 방송을 진행한 결과 플립5·폴드5는 지난해 출시된 갤럭시Z 플립4·폴드4 대비 1.9배가 넘는 판매고를 올렸다. 이날 판매에서 플립5와 폴드5는 각각 70%, 30%의 판매 비중을 나타냈다. 또한 폴드5 1TB는 Z 폴드5 전체 판매 중 35%를 차지해 고용량 스토리지에 대한 소비자 선호도가 매우 높다는 것도 확인됐다. 삼성전자는 사전판매 혜택으로 256GB 모델을 구입하면 512GB 모델로 용량을 두 배 업그레이드해주는 '더블 스토리지'를 제공 중이다. 이로 인해 512GB 모델은 사전판매를 진행하지 않고 있다.현재 삼성닷컴에서 플립5는 민트·크림·라벤더·그라파이트와 닷컴 전용인 그린·옐로·그레이·블루 등 8가지 색상을 판매하고 있다. 폴드5는 기본 아이스블루·크림·팬텀블랙과 닷컴 전용인 그레이·블루 등 5가지 색상으로 구성돼 있다. 이동통신 3사 공시지원금은 플립5 기준 SK텔레콤이 28만7000~48만원, KT가 15만6000~65만원, LG유플러스가 17만5000~50만원이다. 폴드5 기준으로는 SK텔레콤이 13만1000~17만원, KT가 5만~24만원, LG유플러스가 5만2000~23만원이다. 통신 3사를 비교해보면 KT가 상대적으로 공시지원금을 많이 늘리면서 최고경영자(CEO) 공백 사태임에도 공격적인 마케팅에 나서는 형국이다. 통신업계 관계자는 ""플립5 공시지원금은 전년과 같고 폴드5는 전년에 비해 20만원 줄었다""며 ""출고가 인상을 감안하면 플립5는 전작에 비해 5만원, 폴드5는 30만원가량 가격이 더 상승한 것""이라고 말했다. 갤럭시Z 플립5와 폴드5 출고가(256GB) 각각 139만9200원, 209만7700원으로 전년 대비 5~10만원 올랐다.통신업계에서는 폴드5 실질 가격이 30만원가량 상승한 것을 두고 ""삼성전자가 플립5 판매에 집중하고 있는 것""이라는 진단이 나온다. 공시지원금을 기준으로 통신3사 8만원대 무제한 요금제으로 플립5 가입시(512GB 기준) 2년 약정 기준 월 13만원 내외를 납부해야 한다. 반면 쿠팡 등을 통해 플립5 공기계를 구입한 뒤 알뜰폰 LTE 무제한 요금제(11GB+3Mbps 속도 제한·월 3만5200원)를 사용하고 2년에 걸쳐 공기계 값을 나눠 내면 월 납부액은 9만원 초반대다. 알뜰폰을 사용하는 한 20대 후반 소비자는 ""알뜰폰에서 제공하는 청년 할인 혜택(월 7000원대 할인)까지 이용하면 실질적으로 월 8만원대로 플립5를 구입할 수 있다""고 밝혔다. 플립5·폴드5 사전판매가 1~7일 진행되는 가운데 판매량 100만대를 돌파할지 주목된다. []",https://n.news.naver.com/mnews/article/009/0005166873?sid=105

현대오토에버 목표가 줄상향,2023-08-01 17:36:02,매일경제,"2분기 영업이익 83% 증가증권사 전망치 크게 웃돌아현대자동차그룹 계열 전자전기 서비스 업체 현대오토에버 2분기 영업이익이 증권사 평균 전망치(컨센서스)를 크게 웃돌자 증권사들이 목표주가를 일제히 상향 조정했다.1일 금융투자업계에 따르면 이날 상당수 증권사가 목표주가를 올렸다. 삼성증권(17만원→18만5000원) 하이투자증권(17만5000원→18만5000원) NH투자증권(17만5000원→20만원) 등이 목표가를 상향 조정했다.현대오토에버는 지난달 31일 2분기 매출액과 영업이익이 각각 7539억원, 527억원으로 전년 동기에 비해 19.6%, 83.4% 증가했다고 밝혔다. 증권사 평균 전망치는 매출액과 영업이익이 각각 7275억원, 379억원이다. 금융투자업계에서는 영업이익이 크게 늘어난 점에 주목했다. 김현용 현대차증권 연구원은 ""ITO(정보기술(IT) 아웃소싱) 단가 인상분이 소급 적용됐고 차량 소프트웨어 비중 확대에 따른 마진 개선이 겹치며 영업이익이 급증했다""고 설명했다. 전문가들은 현대차그룹 성장세와 함께 현대오토에버가 디지털 전환 관련 수혜를 받을 것으로 예상했다. []",https://n.news.naver.com/mnews/article/009/0005166871?sid=101
불붙는 HMM 인수전… 대어는 누구의 품으로,2023-08-01 17:34:03,국민일보,"국내 최대 컨테이너 선사인 HMM의 인수전이 가열되고 있다. 해운업황이 악화하면서 흥행 부진 우려가 나왔으나 인수 의지를 밝힌 SM그룹을 비롯해 동원그룹 하림그룹 등 굵직한 회사들이 관심을 드러내고 있다. 올해 인수합병(M&A) 시장의 대어로 꼽히는 HMM이 어느 기업의 품에 안길지 관심이 쏠린다.1일 업계 등에 따르면 산업은행과 한국해양진흥공사(해진공)는 지난달 20일 HMM 경영권 공동 매각을 위한 공고를 내고 본격적인 매각 절차에 돌입했다. 산은과 해진공은 HMM의 지분을 각각 20.69%, 19.96% 보유한 최대 주주다. 산은과 해진공은 지난 4월 매각자문단을 구성하고, 매각 타당성 컨설팅을 통해 올해 내에 경영권 매각에 착수하는 것이 타당하다는 결론을 냈었다.HMM은 2016년 이후 7년 만에 시장에 매물로 나오게 됐다. 과거 현대상선이었던 HMM은 유동성 위기로 대규모 공적 자금을 수혈받고 산은의 관리를 받아왔다. 매각 절차는 공개경쟁입찰로 진행된다. 2단계 입찰을 거쳐 우선협상대상자를 선정하고, 연내 주식 매매계약을 체결하는 방식이다.최근 해운업이 침체기에 돌입하면서 HMM의 새 주인 찾기에 어려움이 따를 것이란 예상이 지배적이었다. 해상 운임 하락 영향이 컸다. 컨테이너 운송 15개 항로 운임을 종합한 상하이컨테이너운임지수(SCFI)는 지난해 5000포인트 가까이 올라갔으나 현재는 5분의 1 수준으로 하락했다.인수 의사를 내비친 곳도 SM그룹뿐이었다. 우오현 SM그룹 회장은 한 언론과의 인터뷰에서 “최대 4조5000억원의 자금을 동원할 수 있다”고 인수 금액까지 언급하며 의지를 드러냈다. 대한해운과 대한상선, SM상선 등 해운 계열사를 보유한 SM그룹은 HMM과 인수합병을 통해 사업을 더욱 확장하겠다는 계획이다.하지만 매각 절차 돌입 이후 하림·LX·동원그룹 등이 최근 HMM 매각 주간사인 삼성증권으로부터 투자설명서(IM)를 받아갔다는 소식이 전해면서 경쟁이 치열해지는 분위기다. 하림그룹은 벌크선 해운사인 팬오션을 보유 중인데, HMM을 인수하면 컨테이너선으로 사업을 확장할 수 있다. LX와 동원은 물류 계열사를 보유한 만큼 해상과 지상의 시너지 효과를 기대할 수 있다.관건은 자금 조달력이다. 업계에선 매각 대금을 5조~6조원 정도로 예상한다. 이는 HMM의 현재 시가총액과 비교해 평가한 지분 가치에 경영권 프리미엄을 얹은 수준이다. 인수 의사를 밝힌 이들이 매각가를 소화할 수 있는지 등이 가늠자가 될 것으로 보인다.다만 일각에선 아직 흥행 여부를 예상하기는 이르다는 반응도 나온다. IM 수령은 회사에 대한 관심일 뿐 인수전 참여로 단정할 수 없기 때문이다. 업계에선 현재 거론되는 중견기업들 외에 대기업이 인수전에 출사표를 던질지 주목하고 있다. 첫 관문인 예비입찰 서류 마감일은 오는 21일이다.",https://n.news.naver.com/mnews/article/005/0001627774?sid=101
“내년 HBM 시장 주류는 HBM3와 HBM3E”,2023-08-01 17:34:01,이데일리,"트렌드포스, HBM 시장 전망 공개AI향 수요 증가로 주력 제품 교체[이데일리 ] 인공지능(AI)향 메모리 반도체 수요가 증가하는 가운데 내년 고대역폭메모리(HBM) 시장에서 HBM3와 HBM3E 제품이 주류로 떠오를 것이란 전망이 나왔다.    글로벌 주요 반도체 기업의 고대역폭메모리(HBM) 개발 계획 전망. (사진=트렌드포스)2일 시장조사업체 트렌드포스는 “올해 HBM 시장 주요 제품은 엔비디아와 AMD, 대부분의 클라우드 서비스 제공자들이 사용 중인 HBM2E이지만 인공지능향 칩 수요가 발전하면서 제조업체들이 내년에 HBM3E를 출시할 것”이라며 “HBM3와 HBM3E가 내년 시장에서 주류로 자리 잡을 것”이라고 예상했다.HBM은 D램 여러 개를 수직으로 연결해 데이터 처리 속도를 혁신적으로 끌어올린 고대역폭 메모리다. 데이터가 오가는 통로인 대역폭을 크게 늘려 방대한 정보 처리가 필요한 AI 산업에 활용 가능하다. 트렌드포스는 속도에 따라 HBM3를 두 종류로 나눴다. HBM3는 5.6~6.4Gbps(초당 기가비트) 사이의 속도로 실행되는 HBM을 말하며 HBM3P, HBM3A, HBM3+ 등의 이름을 가진 8Gbps 속도의 HBM은 HBM3E로 봤다.트렌드포스는 삼성전자(005930)와 SK하이닉스(000660), 미국 마이크론 등이 내년 1분기에 HBM3E 샘플을 출하할 것이라고 관측했다. 마이크론은 HBM3를 건너뛰고 HBM3E 개발을 시작할 전망이다. HBM3E 양산은 내년 하반기로 예상했다. 현재 메모리업계가 양산하는 최선단 HBM제품은 HBM3이며 SK하이닉스가 독점공급하고 있다. 삼성전자는 연내 양산 예정이다.",https://n.news.naver.com/mnews/article/018/0005542205?sid=101
홍원표 SK쉴더스 신임 대표,2023-08-01 17:32:15,매일경제,"SK쉴더스가 홍원표 전 삼성SDS 대표(사진)를 신임 대표(부회장)로 선임했다.1일 SK쉴더스는 홍원표 전 삼성SDS 대표를 신임 대표로 선임했다고 밝혔다. 홍 신임 SK쉴더스 대표(CEO)는 미국 벨통신연구소, KT 전무, 삼성전자 사장을 거쳐 2015년부터 2021년까지 삼성SDS 사장, 대표이사를 역임했다.[]",https://n.news.naver.com/mnews/article/009/0005166847?sid=105
[DD퇴근길] 中게임사들의 사람 낚는 마케팅?,2023-08-01 17:32:01,디지털데일리,"디지털데일리가 퇴근 즈음해서 읽을 수 있는 [DD퇴근길] 코너를 마련했습니다. 혹시 오늘 디지털데일리 기사를 놓치지는 않으셨나요? 퇴근 앞두고 저희가 요약 정리한 주요 기사를 가벼운 마음으로 읽어주시기 바랍니다. 전체 기사는 ‘디지털데일리 기사 하단의 관련뉴스(아웃링크)’에서 확인할 수 있습니다.    [사진출처=구글플레이 화면 갈무리]접속 즉시 게임 캐릭터 뽑기권 1000개 지급? 알고 보니…게임을 받자마자 캐릭터를 1000개나 뽑을 수 있다면 누가 다운로드를 망설일까요? 최근 국내에 모바일게임을 서비스하는 중문 문화권 소재 게임사를 중심으로, 접속만 하면 이른바 ‘1000뽑’(게임 캐릭터 뽑기권 1000개)을 즉시 지급한다는 식의 게임 제목을 내세우며 이용자를 유인하는 마케팅이 늘고 있습니다. 그러나 실상은 다른데요. 이는 모두 기존 국산 모바일게임과 마찬가지로, 게임을 기준치 이상 플레이해야 조건부로 받을 수 있는 뽑기권입니다.중국 게임들을 중심으로 이러한 마케팅이 지속되고 있습니다. 또, 이 게임들은 당초 국내 이용자를 대상으로 장르를 액션 역할수행게임(RPG) 및 RPG로 광고되고 있지만, 모두 사실은 조작할 필요가 없는 방치형 게임인 것으로 나타났는데요. 가짜 광고를 펼치는 중국 게임들을 중심으로 국내 이용자 불만이 커지고 있지만 고객센터 또한 미비해 주의가 요구됩니다.    헥스가 구입했다고 알려진 블랙 다이아몬드 [ⓒ연합뉴스]최초의 고수익 블록체인 예금증서?…코인 팔아, 38억년 전 다이아몬드 구입한 헥스미국 증권거래위원회(이하 SEC)가 가상자산 프로젝트 헥스(HEX)를 미등록 증권 판매 및 사기 혐의로 기소했습니다. 이에 따라 얼마전 리플랩스가 SEC와 소송에서 일부 승소하면서 리플(XRP)이 증권성 여부에 대한 논란에서 벗어난 것도 잠시, 코인의 증권성을 두고 다시 한번 시장이 영향을 받는 모습을 보였습니다. 가상자산 시총이 24시간 전 보다 소폭 하락한 것인데요.앞서 31일(현지시각) SEC는 XRP에 이어 또 한번 코인에 증권성 판단 잣대를 적용하기 시작했습니다. SEC는 2019년부터 3가지 미등록 증권을 공모해 10억 달러 이상 자금을 조달했다는 혐의로 리처드 하트와 그의 가상자산 프로젝트 헥스, 펄스체인, 펄스엑스를 기소하고 나선 것인데요. SEC는 리처드 하트가 투자자들에게 해당 코인을 이더리움을 기반으로 한 최초의 고수익 블록체인 예금증서(CD)라고 선전하며 38%에 달하는 수익률을 보장한다고 투자자들을 유인한 것으로 판단했습니다. 또 SEC는 리처드 하트가 2019년 12월부터 2020년 11월까지 헥스 코인을 미등록 발행해 총 230만 이더리움(ETH)을 모은 것으로 보고 있습니다. 이에 더해 리처드 하트가 이렇게 모집된 투자금 일부를 개인적인 사치품을 구입하는데 사용했다고 보고 사기 혐의도 추가했네요. 사치품 목록에는 약 26억에서 38억년 전 우주에서 온 것으로 보이는 555.55캐럿짜리 세계 최대 블랙 다이아몬드가 포함된 것으로 알려지고 있습니다.    삼성전자의 새로운 폴더블 스마트폰 '갤럭시Z플립5'와 '갤럭시Z폴드5'에 대한 이동 통신 3사의 사전 판매가 시작된 1일 오전 서울의 한 통신사 대리점에 관련 홍보문이 부착되어 있다. [ⓒ 연합뉴스]갤럭시Z폴드·플립5 싸게 사려면…공시지원금·약정할인 중 뭐가 좋을까?통신3사가 삼성전자 신규 폴더블 스마트폰 ‘갤럭시Z폴드5’와 ‘갤럭시Z플립5’에 대한 공시지원금을 전작보다 낮게 책정할 것으로 보입니다. 1일 SK텔레콤·KT·LG유플러스 등 통신3사는 갤럭시Z폴드5·Z플립5의 예상 공시지원금을 공개했는데요. 업체별로 SK텔레콤은 공시지원금으로 각각 Z폴드5 13만1000원~17만원, Z플립5 28만7000~48만원을 책정했고, KT는 Z폴드5 8만5000~24만원, Z플립5 25만5000~65만원을, LG유플러스는 Z폴드5 8만4000~23만원, Z플립5 28만~50만원의 공시지원금을 제공할 예정입니다.이번 Z폴드5와 Z플립5에 전작과 같거나 적은 공시지원금이 책정된 만큼 소비자들은 공시지원금보다 선택약정할인이 더 유리할 것으로 전망되는데요. 예컨대 KT를 기준으로 계산해보면, 제일 비싼 월 13만원의 ‘초이스 프리미엄’ 요금제를 이용해야만 최대 지원금을 받을 수 있죠. 이 경우 24개월 약정을 전제로 Z폴드5는 24만원, Z플립5는 65만원의 공시지원금을 받게 됩니다. 반면 선택약정할인으로는 두 기기 모두 2년간 78만원의 요금할인을 받을 수 있습니다. 요금제별 공시지원금을 잘 따져서 어느 것이 더 유리할지 비교해보는 것을 추천드립니다.    카카오엔터 산하 스타쉽엔터테인먼트 소속 그룹 ‘아이브’ [ⓒ 카카오엔터테인먼트]SM 품은 카카오 “아이브·에스파, 북미로 간다”SM엔터테인먼트를 인수한 카카오엔터테인먼트가 양사 협업을 위한 첫 단추로 북미 시장을 낙점했습니다. 세계 엔터테인먼트 산업 중심인 북미를 핵심 거점으로, 견고한 사업 협력 기반과 노하우를 확보하고 유럽 등 글로벌 시장 공략을 가속한다는 전략인데요. 1일 카카오엔터(대표 김성수, 이진수)는 SM과 북미 현지 통합 법인을 출범한다고 밝혔습니다. 양사는 북미 통합 법인을 통해 소속 아티스트 글로벌 진출을 가속화하고, 신규 지식재산권(IP) 개발과 투자에도 적극 나설 방침이죠.북미 현지 통합 법인 대표는 카카오엔터 글로벌전략담당(GSO)이자 카카오엔터아메리카 대표인 장윤중이 맡았습니다. 장윤중 대표는 소니뮤직코리아 대표 출신으로, 올해 상반기부터 SM 최고비즈니스책임자(CBO)도 겸임하고 있죠. 장 대표는 카카오엔터 뮤직 부문 글로벌 경쟁력 강화를 위해 중추적 역할을 해왔습니다. 산하 레이블 소속 아티스트들 해외 현지 활동을 지원하기 위해 글로벌 360도 매니지먼트 시스템을 구축하고, 유수 글로벌 엔터기업 및 전문가들과 협력 체계를 강화 중이죠. 지난 4월에는 미국 음악 전문 매체 빌보드가 발표한 ‘2023년 빌보드 인터내셔널 파워 플레이어스’에 선정되기도 했습니다.    [ⓒ NEOM 홈페이지 캡처]네옴시티 정조준한 국내 기업들…IoT·AI 미래산업 기업 집결사우디아라비아(이하 사우디)의 초대형 미래도시 건설 프로젝트 '네옴시티'를 계기로 국내 기업들의 중동향 사업 채비가 본격화되고 있습니다. 진출 분야는 사물인터넷(IoT)부터 인공지능(AI)까지 다양한데요. 센코는 LG유플러스와 세종 스마트시티 국가시범도시 조성 사업의 스마트 IoT 개발에 힘을 합치며 글로벌 진출 가능성을 고려하고 있는 것으로 알려졌습니다. 헬스케어 스타트업 알고케어는 지난 6월 아랍에미리트(UAE) 구성국인 샤르자 에미리트의 셰이크 사우드 술탄 빈 모하메드 알 카시미 왕자를 만나 협력을 논의하기도 했습니다.푸드테크 로봇 기업 웨이브라이프스타일테크는 지난 3월 사우디 투자부(MISA)와 사우디 현지 사업 확대를 위한 양해각서를 맺었고, 비주얼 AI 기업 비브스튜디오는 최근 DDP '디스커버 네옴 프라이빗 미팅'에 참석해 자사 경쟁력을 직접 소개하기도 했습니다. 다만 네옴시티의 실행 가능성 여부에 대한 의구심이 남아있는 만큼, 신중한 접근이 필요하다는 지적도 나오고 있습니다.",https://n.news.naver.com/mnews/article/138/0002153588?sid=105
"LG헬로, 이달 '모토로라 폴더블' 선보인다",2023-08-01 17:31:03,서울경제,"'레이저40 울트라'···외국산 첫 출시    모토로라의 폴더블폰 신제품 '레이저40울트라' 사진제공=모토로라[서울경제] LG헬로비전이 이달 중 모토로라 신형 폴더블폰 ‘레이저40 울트라’를 국내 공식 출시한다. 외산 폴더블폰의 첫 국내 공식 출시로, 출격을 앞둔 삼성전자 갤럭시Z 플립·폴드5와 함께 8월 국내 스마트폰 시장에서 ‘폴더블 대전’이 펼쳐질 전망이다.1일 이동통신업계에 따르면 LG헬로비전은 최근 모토로라코리아와 이달 중 레이저40 울트라를 공식 출시하기 위한 협의를 마쳤다. 이 제품은 앞서 최근 국립전파연구원 전파인증을 마친 바 있다. 외산 폴더블폰이 자급제가 아닌 형태로 출시되는 것은 국내에서 처음이다.레이저40 울트라는 해외에서는 6월 초 공개된 제품이다. 갤럭시Z 플립 시리즈와 같은 클램셸(조개껍데기) 형태로, 갤럭시Z 플립5보다 빠르게 대형 커버 디스플레이를 탑재해 주목받았다. 레이저40 울트라의 커버 디스플레이는 3.6인치로 갤럭시Z 플립5의 3.4인치보다 크다. 단 레이저40 울트라 외부 화면은 카메라 부위를 펀치홀 형식으로 둘러싸는 형태로, 실제 사용 가능한 면적은 갤럭시Z 플립5와 유사한 것으로 알려졌다.스마트폰의 두뇌에 해당하는 애플리케이션프로세서(AP)는 ‘스냅드래곤8+’ 1세대로 삼성전자의 지난해 모델인 갤럭시Z 플립4와 같지만, 모바일AP를 제외한 전반적인 성능은 갤럭시Z 플립5와 비슷한 수준이다. 무게는 184g으로 플립5의 187g보다 가볍고, 접었을 때 최저 두께는 15.1mm로 같다.관건은 가격이다. 레이저40 울트라는 유럽 기준 1200유로(169만원)로 갤럭시Z 플립5의 1199유로보다 비싸다. 다만 자급제가 아닌 통신사를 통한 구매인 만큼 지원금을 받을 수 있고, 알뜰폰인 LG헬로비전 요금이 저렴해 실사용료는 이통3사에서 갤럭시Z 플립5를 구매하는 것보다 저렴할 것으로 예상된다.",https://n.news.naver.com/mnews/article/011/0004221335?sid=105
[잇써보니] 완전 방수에 '굿노트' 탑재…S펜은 종이에 쓰듯 매끄러워,2023-08-01 17:30:13,서울경제,"■갤럭시탭S9 울트라IP68 방수·방진···야외 안정감 높여안드로이드 첫 '굿노트' 탑재 주목세밀한 S펜 필압, 충전 편리 높여[서울경제] 지난달 26일 언팩(제품공개)을 통해 공개된 ‘갤럭시탭S9 울트라’에 대한 관심이 어느때보다 높다. 신형 퀄컴 칩셋인 ‘스냅드래곤 8 2세대’가 내장된데다 아이패드 필수 앱이라 불리는 ‘굿노트’를 안드로이드 운영체제(OS) 기기 중 최초로 탑재해 ‘역대급 태블릿’이라는 평가가 나온다.실제 갤럭시S23·갤럭시Z5에서 증명된 신형 칩셋 성능은 애플 칩셋과 비등한 성능을 자랑 중이며, 굿노트와 S펜은 아이패드 못지 않은 유연한 연계를 제공한다. 그간 러기드(Rugged·야외 사용 특화) 태블릿에서만 볼 수 있던 방수·방진 또한 이번 제품의 특징이다. 높은 가격이 진입장벽으로 작용할 수 있지만 각종 성능을 높고 보면 안드로이드 진영의 최강 태블릿이 나왔다는 평가가 전혀 과찬이 아니다.    갤럭시탭S9 시리즈는 탭S 최초로 IP68 등급 방수 방진을 지원해 물에 담근 후 사용해도 문제가 없다. 갤럭시탭S9 울트라를 1일 체험해봤다. 갤럭시탭S9 시리즈는 기본형이 10.95인치, 플러스가 12.4인치, 울트라는 14.56인치다. 화면 크기 외 모바일AP는 같고, D램은 기본 12GB(기가바이트)지만 울트라 최상위 모델인 1TB(테라바이트)의 경우에는 16GB를 탑재했다.전작인 갤럭시탭S8은 당대 안드로이드 최강 태블릿이었지만 아이패드에 뒤쳐지는 성능과 높은 가격으로 시장의 외면을 받았다. 이번 신작은 성능이 대폭 개선된 점이 인상적이다. 긱벤치6 측정 결과 싱글코어 2100점, 멀티코어 5600점 이상이 나왔다. 싱글코어 1300점을 넘지 못했던 전작의 두배에 달하는 성능으로, 싱글코어 한정으로 M1 칩셋을 사용한 아이패드 프로 3세대와 비슷한 결과다. 특히 같은 스냅드래곤8 2세대 for 갤럭시 칩셋을 쓰는 갤럭시S23·갤럭시Z 폴드5보다도 10%가량 높은 수치인 점이 눈에 들어온다. 베이퍼챔버 등 여유 있는 냉각 설계로 더 높은 성능을 이끌어낸 것이다.애플 앱스토어 최고 인기앱 중 하나인 굿노트는 S펜과 함께 아이패드와 동등한 사용성을 보여준다. 굿노트를 아이패드 구입 이유로 꼽아왔던 소비자들이 많은 만큼 삼성전자가 ‘승부수’를 띄웠다는 평가다. 4096단계의 세밀한 필압으로 유명한 S펜은 마치 종이에 적어내리는 듯한 느낌을 줬다. S펜은 이번작부터 태블릿 후면에 앞뒤 구분 없이 장착해도 충전이 가능해 더욱 사용이 편해졌다.    갤럭시탭S9 울트라 그라파이트 색상. 사진제공=삼성전자삼성전자가 자신한 IP68 방수·방진도 훌륭하다. 흐르는 물에 담궈도 물방울이 방수포를 타고 내려오듯 방울져 흘러 내리고 물 속에서도 작동에 문제가 없었다. 스마트폰 수준 방수로 야외 사용시 안정성이 더욱 높아질 것으로 보인다.전반적으로 기능 측면에서 흠 잡을 데 없는 태블릿이지만 높은 가격이 흥행의 변수다. 갤럭시탭S9은 기본형이 최저 99만8000원이다. 울트라는 159만8300~240만6800원에 달한다. 경쟁작인 아이패드 10세대 최저 가격이 와이파이·64GB 기준 67만9000원임을 떠올려보면 가격차가 큰 편이다.",https://n.news.naver.com/mnews/article/011/0004221333?sid=105
