
조기 출시 통했다…사전판매 2배 '신기록',2023-08-01 18:07:03,서울경제,"■갤Z 폴드·플립5 첫날 예약폭주내달 출시 아이폰15 제대로 저격디자인·사용성 개선 등 호응 커폴더블 판매량 50% 증가 '청신호'[서울경제] 삼성전자(005930)의 플래그십 폴더블폰 갤럭시Z 플립·폴드5가 예약판매 시작부터 돌풍을 일으키고 있다. 플립5의 커버 디스플레이 확대와 신형 모바일 애플리케이션프로세서(AP)의 높은 성능, ‘플렉스 힌지’ 적용으로 얇아진 두께 등이 흥행 요소로 풀이된다. 조기 출시라는 승부수를 띄운 삼성전자의 ‘폴더블 판매량 50% 증가’ 목표가 성공적으로 첫 발을 내디뎠다는 평가가 나온다.    삼성전자는 1일 이날 자정부터 새벽 1시40분까지 삼성닷컴에서 진행한 갤럭시Z 플립·폴드5 사전예약 생방송에서 전작 대비 1.9배의 판매량을 기록했다고 밝혔다. 이미 신기록을 기록했던 전작의 2배 가까운 판매고를 올리며 신작에 대한 높은 기대감이 높은 사전예약으로 이어졌다는 평가다. 삼성전자 관계자는 “갤럭시 Z 플립·폴드5의 디자인과 사용성이 소비자의 마음을 사로잡는데 성공했다고 본다”며 “사전예약시 저장장치 용량을 2배 올려주고 갤럭시워치6 등을 제공하는 행사에 대한 호응이 높았다”고 말했다.이날 사전 판매에서 플립5와 폴드5 판매 비중은 각각 70%와 30%로 외부 화면이 확대된 플립5에 대한 높은 선호도가 확인됐다. 폴드5 중에서는 고가 논란에도 1TB(테라바이트) 판매 비중이 35%에 달했다. 폴드5 1TB의 가격은 246만700원으로 삼성닷컴에서만 판매한다.SKT·KT·LGU+ 등 통신3사 사전예약도 활황이다. 통신3사는 플립5에 최대 65만 원의 공시지원금을 제공하며 가입자 유치전에 나서고 있다. 이 경우 플립5 기계가격은 출고가 139만9200원의 절반 수준으로 떨어진다. LG유플러스 관계자는 “전작 대비 호응이 더 좋다”며 “플립의 인기가 유지되는 가운데 플립5는 크림·민트, 폴드5는 아이스블루·크림이 선호도가 높다”고 말했다.IT업계는 예년보다 2주가량 빨리 열린 이번 언팩 효과에 주목하고 있다. 삼성전자의 조기출시 ‘승부수’가 통했다는 뜻이다. 삼성전자는 이른 폴더블폰 출시를 통해 9월 애플 ‘아이폰15’ 등장에 앞서 폴더블 대세화를 이루겠다는 전략을 취하고 있다. IT업계 한 관계자는 ""올해는 신작 출시가 빨라 전작과 더불어 폴더블 ‘쌍끌이’ 효과가 큰 데다 아이폰15 대기 수요를 사전에 흡수할 수 있다”고 말했다.화웨이·샤오미·아너·오포·모토로라·구글 등 후발주자들이 상반기 중 폴더블폰을 꾸준히 내놓은 점 또한 삼성전자에게는 기회다. 시장 점유율 다툼이 치열해질 수 있다는 우려에도 전반적인 시장 관심도가 높아진다는 점에서 긍정적인 효과가 더 크다. 시장조사기관 트렌드포스는 생태계 확대에 따라 올해 글로벌 폴더블폰 출하량이 1980만 대로 지난해 1280만 대에서 55% 증가한다는 전망을 내놓기도 했다. IT업계 한 관계자는 “경쟁자가 늘었지만 관련 시장을 열고 폴더블 디스플레이를 사실상 독점 생산하는 삼성전자가 내구성과 사용성 면에서 압도적”이라며 “경쟁사 주력 칩셋이 ‘스냅드래곤8+ 1세대’인 반면 갤럭시Z 플립·폴드5는 ‘스냅드래곤8 2세대 for 갤럭시’를 적용한데다 경쟁작들 가격이 저렴한 편도 아니다”라고 설명했다. 이에 노태문 삼성전자 MX사업부장(사장)은 지난달 28일 기자간담회에서 “삼성전자도 폴더블 시장 성장률 만큼의 판매량 증진을 기대하고 있다”고 밝히며 50%대 판매량 증가를 목표로 내세우기도 했다.IT업계는 삼성전자의 폴더블 승부수가 MX사업부는 물론 전사 3분기 실적에 끼칠 영향 또한 예의주시 중이다. 반도체 경기가 좀처럼 회복되지 않는 와중에, 예년에는 4분기에 포함되던 폴더블 실적이 3분기로 당겨지며 실적에 긍정적 영향을 미칠 전망이다. 삼성전자 MX사업부는 2분기 영업이익 3조400억 원을 기록하며 각 부문 중 최고 실적을 거뒀고 3분기에도 실적 버팀목이 될 것이라는 기대를 받고 있다.",https://n.news.naver.com/mnews/article/011/0004221378?sid=105
"코스피 연고점 경신 2,660선 마감…환율 1,280원대",2023-08-01 18:07:01,SBS Biz,"[앵커]국내증시가 8월의 첫 거래일을 맞아 일제히 반등에 성공했습니다.코스피는 외국인과 기관 투자자의 대량 순매수세에 힘입어 연중 최고 기록을 갈아치웠는데요., 코스피가 연고점을 경신했다고요?[기자]오늘(1일) 코스피는 어제(31일)보다 1.31% 오른 2,667.07에 장을 마치며 나흘 연속 반등에 성공했습니다.지난해 6월 이후 1년 2개월 만에 연중 최고 기록을 다시 갈아치웠습니다.기관이 3천300억 원, 외국인이 2천억 원 가까이 순매수하며 지수를 밀어 올렸는데요.투자 자금도 반도체와 인터넷, 자동차, 헬스케어 업종 등으로 골고루 유입돼 2차전지 쏠림도 완화됐습니다.시가총액 상위 종목 역시 삼성전자와 SK하이닉스 등 반도체 종목이 1%대 상승률을 기록했고 삼성바이오로직스 등 바이오 종목들도 4%대 상승률을 보이는 등 전반적으로 고른 상승 흐름을 보였습니다.코스닥 지수는 어제보다 0.40% 오른 939.67을 기록하며 사흘 연속 상승했습니다.그동안 반등을 이끈 2차전지주에서 차익 매물이 쏟아져 출렁이는 모습을 보였지만 보합권에서 거래를 마쳤습니다.2차전지 종목인 에코프로비엠과 금양은 상승 곡선을 그리다가 회사 소속 임원의 자사주 처분 소식에 일제히 하락했습니다.[앵커]원·달러 환율 흐름은 어땠나요?[기자]원·달러 환율은 어제보다 9원 20전 오른 1천283원 80전을 기록했습니다.지난달 무역수지가 흑자를 기록했지만, 수입이 수출보다 줄어든 점, 하반기 무역 개선 여력이 축소된 점 등이 원화 약세를 이끌었습니다.[하건형 / 신한투자증권 연구원: 엔·달러 환율이 올라가면서 엔화 약세가 계속 전개되고 있고, 그게 원화에도 연동되면서 (원·달러 환율이 오른 것으로 보여요.)]이처럼 주요국 통화 약세 흐름 속 달러화 강세 기조가 재차 고개를 들면서 원·달러 환율은 당분간 약세 기조를 이어갈 것으로 보입니다.SBS Biz 지웅배입니다.당신의 제보가 뉴스로 만들어집니다.SBS Biz는 여러분의 제보를 기다리고 있습니다.홈페이지 = https://url.kr/9pghjn",https://n.news.naver.com/mnews/article/374/0000345799?sid=101

"[넘버스] '대어' 서울보증보험, 내달 증권신고서 제출…공모구조 설계 '고심'",2023-08-01 18:05:01,블로터,"넘버스는 <블로터>가 선보이는 기업분석·자본시장 뉴스 제공 서비스입니다.     SGI서울보증보험(서울보증보험)이 내달 유가증권시장(코스피) 상장을 위한 증권신고서를 제출한다. 올해 하반기 기업공개(IPO) 시장 대어로 꼽히는 데다 공기업이라는 특수성으로 인해 공모가 산정 등을 두고 고심하는 것으로 전해진다.     서울보증보험 본사.(사진=서울보증보험) 1일 투자은행(IB) 업계에 따르면 서울보증보험은 오는 9월 증권신고서를 금융감독원에 제출할 예정이다. 상장 예비심사를 청구한 날은 지난 6월 19일로, 통상 예비심사 청구 후 영업일 기준 45일이 소요되는 점을 감안하면 심사 승인 이후 약 2~4주 안에 증권신고서를 제출하는 셈이다.공모가 산정과 관련해 최대주주와 증권사 등 이해관계자들이 고심하고 있는 것으로 전해진다. IB업계 관계자는 ""(서울보증보험은) 예상 기업가치가 큰 것도 있지만, 13년 만에 나온 공기업 IPO 타자이기 때문에 공모 구조를 짜는 게 쉽지는 않을 것""이라며 ""올해 안에 상장하는 걸 목표로 9월께 증권신고서를 제출할 예정으로 알고 있다""라고 말했다.실제 서울보증보험의 기업가치 산정을 두고 시장에선 의견이 분분하다. 피어그룹을 어디로 두느냐에 따라 몸값 차이가 크게 벌어질 수 있어 그 기준에 대한 관심이 적지 않다.IB업계에서 보고 있는 서울보증보험의 적정 몸값은 약 2조~3조원이다. 먼저 손해보험업계 1위인 삼성화재의 평가기준을 적용하면 서울보증보험의 기업가치는 4조원대로 올라선다. 한국거래소에 따르면 이날 기준 삼성화재의 주가순자산비율(PBR)은 0.87배다. 서울보증보험이 지난해 말 기준 자기자본(5조411억원)에 삼성화재와 같은 PBR을 적용한다면 기업가치는 4조3858억원이다.하지만 서울보증보험과 삼성화재를 같은 선상에 놓고 비교할 수는 없다. 서울보증보험은 삼성화재 대비 자산과 자본 규모, 수익성 모두 열위에 있다. 서울보증보험의 지난해 순이익은 5685억원으로 삼성화재 순이익(1조2837억원)의 절반에도 못 미친다.게다가 서울보증보험은 현재 '배당수익률'을 제외하면 이렇다 할 경쟁력이 없는 상황이다. 서울보증보험의 지난해 배당액은 주당 4000원으로, 배당 성향이 50%다. 하지만 이 배당은 최대주주인 예금보험공사의 공적자금회수라는 '엑시트(투자금 회수)' 목적이 분명하다. 아울러 서울보증보험의 올해 1분기 순이익이 687억원으로 전년 동기 대비 14.7% 감소해 높은 배당수익률이 이번 기업가치 평가에 긍정적으로 작용할지는 미지수다.삼성화재를 비롯한 국내 상장 손해보험사의 평균 PBR로 계산하더라도 결과값은 크게 달라지지 않는다. 이날 기준 국내 상장 손해보험사의 평균 PBR은 0.9배 안팎이다. 이를 서울보증보험에 적용하면 약 4조5000억원이 나온다. 여기에 20~30%의 할인율과 상장예정주식수(6982만1598주)를 반영하면 기업가치는 3조원 중반대, 공모가는 5만원 수준으로 계산된다. 만약 지난해 말 기준 손해보험사 평균 PBR(약 0.5배)을 적용하면 기업가치 2조원 초반대, 공모가 3만원 수준으로 떨어진다.서울보증보험이 피어그룹을 해외에서 물색할 가능성도 있다. 실적과 사업 유사성을 지닌 곳을 국내에서 찾는 게 마땅치 않을 때 택하는 주로 방식이다. 일례로 보험법인대리점(GA) 에이플러스에셋은 2020년 IPO 당시 아서 J 갤러거(Arthur J Gallagher & Co), 팬후아(Fanhua Inc), 브라운 앤 브라운(Brown & Brown Inc.)을 피어그룹으로 삼았다.하지만 보험업 특성상 국내외 환경이 다른 데다 외국 기업과 비교해 공모가를 산정하면 '뻥튀기'논란이 나올 수 있어 서울보증보험이 이런 선택을 할 가능성은 비교적 낮을 것으로 판단된다.주관사인 미래에셋증권은 ""예비심사를 청구할 때 피어그룹을 한 차례 정했었고, 이후 증권신고서를 제출할 때 일부 수정이 있을 수 있다""라고 말했다.서울보증보험은 ""현재 예비심사 결과를 기다리고 있고, 올해 안에 상장하는 것을 목표로 하고 있다""라고 전했다.",https://n.news.naver.com/mnews/article/293/0000046519?sid=101
"당신이 필요한 모든 것, 편의점이 해결해드립니다",2023-08-01 18:05:10,디지털타임스,"GS25, 갤럭시 신제품 스튜디오전시회 예매서비스 선보이기도CU는 송금·알뜰택배 서비스이마트24도 대한항공과 협업    모델들이 GS25에서 선보이는 한정판 짱구X발란사 굿즈를 선보이고 있다. GS리테일 제공    포화상태서 살길 찾는 편의점지난달 30일 서울 성수동에 있는 편의점 GS25 플래그십 매장 '도어투성수'에 삼성 갤럭시 신제품을 선보이는 스튜디오가 열렸다. 갤럭시 신제품이 편의점에서 스튜디오 방식으로 전시된 것은 이번이 처음이다.이 뿐만이 아니다. 편의점에서 게임을 즐길 수도 있고, 영화에 나왔던 맥주와 안주 등을 직접 살 수 있는 코너도 등장했다. 택배 서비스는 물론이고 전시회 예매까지 가능하다. 전국에 3만개 이상이 운영되며 포화 상태에 이른 편의점들은 경쟁에서 이기기 위해 이종업체와의 협력으로 무한 확장하고 있다. 1일 업계에 따르면 GS25를 비롯해 CU, 이마트24 등 주요 편의점들은 이종업계와의 결합 서비스를 공격적으로 확장하고 있다. 가장 적극적인 곳은 GS25다. 먼저 넥슨과 협업해 인기 게임 '메이플스토리'를 활용한 상품을 출시했으며 작년 12월에는 '도어투성수'에 팝업스토어를 선보이기도 했다. 이 뿐만 아니라 지난 2월에는 발렌타인데이를 맞아 캐릭터 '짱구'와 키친웨어 브랜드 '크로우캐년'과 협력해 초콜릿 세트 상품을 출시하기도 했다. 후속으로 화이트데이에는 패션 브랜드 '발란사'와 짱구 캐릭터를 접목해 세트 상품과 팝업스토어를 열면서 젊은 세대의 관심을 이끌어내기도 했다.최근에는 약 2억3300만 회원을 보유한 엔터테인먼트 스트리밍 서비스 넷플릭스와도 손을 잡았다. 지난 6월 중순부터 넷플릭스 콘텐츠를 활용한 맥주, 안주, 스낵 등 차별화 상품을 선보였으며, 지난달에는 넷플릭스 팝업스토어를 운영했다.이 밖에도 전시기획제작사 미디어앤아트의 전시 브랜드 '그라운드시소'와 함께 편의점에서 전시회 예매 서비스를 이용할 수 있도록 했다.편의점 CU를 운영하는 BGF리테일도 온·오프라인 플랫폼을 연계해 다양한 비즈니스 시너지를 모색하고 있다. 지난달 28일에는 중고나라와 업무협약을 맺고 사업 제휴 확대를 추진하기로 했다. 중고나라에서 CU알뜰택배 예약 서비스를 이용하도록 하거나, 중고나라에서 거래를 예약한 뒤 편의점에서 송금할 수 있도록 하는 등 비즈니스 연계를 모색한다.6월에는 하나은행과 손 잡고 네 번째 금융 특화 편의점인 'CU옥정노블랜드점'을 오픈하기도 했다. 하나은행의 경우 지역 고객들의 접근성을 강화할 수 있고, CU 역시 금융서비스 이용 고객을 대상으로 편의점 제품을 판매할 수 있다는 점에서 이종 업계 간의 '윈-윈' 모델이다.이 밖에도 이마트24는 최근 대한항공이 플레이그라운드브루어리와 협업해 만든 수제맥주 '칼스라거'의 판매를 시작했다. 이 맥주는 인천공항 내 일등석·마일러 클럽·프레스티지석 라운지와 김포공항 국제선 KAL 라운지에서도 볼 수 있으며, 오는 9월부터는 대한항공 기내 서비스로도 제공될 예정이라 집에서 해외여행을 떠나는 기분을 느낄 수 있다.GS25 관계자는 ""다양한 채널과의 협업을 진행하고 있는 이유는 브랜드 가치 상승과 더불어 차별화되고 재미난 경험을 즐기는 요즘 세대들을 신규 고객으로 창출시키기 위함""이라며 ""이색적이고 재미난 협업을 지속 확대해 고객 만족을 실현해 나갈 계획""이라고 말했다.",https://n.news.naver.com/mnews/article/029/0002817082?sid=101
"""Z플립5·폴드5 삼성카드 사전예약…8% 할인·무이자할부 24개월""",2023-08-01 18:02:01,부산일보,"삼성카드는 갤럭시 Z플립5·Z폴드5 출시를 기념해 삼성닷컴 사전 예약 이벤트를 진행한다고 1일 밝혔다.우선 삼성닷컴에서 갤럭시 Z플립5 또는 Z폴드5를 삼성카드로 예약 구매한 고객에게 5% 결제일 할인을 최대 50만 원까지 제공한다.또한 '삼성스토어 베네핏 삼성카드'로 결제 시에는 전월 실적에 따라 추가로 3% 할인을 최대 3만 원까지 받을 수 있다. 이외에도 2, 3, 24개월 할부 결제시 무이자 혜택도 받을 수 있다.사전예약 이벤트는 오는 7일까지 진행되며, 자세한 내용은 삼성카드 홈페이지와 앱, 삼성닷컴 홈페이지를 통해 확인할 수 있다.삼성카드 관계자는 ""갤럭시 Z플립5, Z폴드5 출시를 기념해 삼성닷컴 사전예약 이벤트를 준비했다""며 ""앞으로도 고객에게 유용한 혜택을 제공할 수 있는 이벤트를 지속적으로 진행할 계획""이라고 말했다.",https://n.news.naver.com/mnews/article/082/0001225052?sid=101


"“TSMC, 탈대만화 없다지만…” 대만의 아킬레스건 찌르는 미국",2023-08-01 18:01:37,중앙일보,"팻 겔싱어 인텔 CEO. 인텔       “대만은 안정적인 곳이 아닙니다. 중국은 이번 주에만 대만 방공식별구역(ADIZ) 내에 인민해방군 군용기 27대를 보냈지요.”      팻 겔싱어 인텔 최고경영자(CEO)는 2021년 12월 1일 미국 캘리포니아에서 열린 ‘포춘 브레인스톰 테크’(Fortune Brainstorm Tech) 컨퍼런스에서 돌연 대만 이야기를 꺼냈다. 당시 반도체지원법(칩스법)의 미 의회 통과를 앞둔 상황에서 한국의 삼성전자나 대만 TSMC 같은 아시아 반도체 업체보다 인텔과 같은 미국 반도체 업체에 더 많은 투자가 이뤄져야 한다는 취지에서 나온 말이었다.      당시 겔싱어의 발언을 두고 미국과 한국에서는 별다른 반응이 없었지만 지구 반대편 대만에서는 그야말로 난리가 났다. 주요 대만 언론들은 일제히 겔싱어의 말을 대서특필했다. 이후 겔싱어와 인텔에 대한 날선 비난이 쏟아졌다. “그렇게 불안정한 곳이라면 인텔은 왜 TSMC에 반도체 생산을 맡기나?” “도저히 이길 수 없으니 억지를 부려 공격하는 것” 등 비판 여론이 극에 달했다.          지난 2012년 투자자 앞에서 연설하는 TSMC의 창업주 모리스 창. TSMC는 세계 1위 반도체 파운드리 업체다. 연합뉴스       TSMC 창업주 모리스 창(張忠謀)까지 직접 나서 “미국 정부 보조금을 더 받으려는 얄팍한 시도”라며 “인텔은 다시 영광의 시대로 돌아갈 수 없을 것” 등 거친 말을 있는 그대로 쏟아낼 정도였다.      반도체 업계 한 관계자는 “지정학적 문제, 특히 중국의 대만 침공 가능성은 언급하는 것만으로도 TSMC, 나아가 대만 전체에 있어 일종의 ‘발작 버튼’과 같다”고 말한다. 전 세계 파운드리(반도체 위탁생산) 1위 TSMC의 사실상 유일한 ‘아킬레스건’으로 꼽히는 지정학적 리스크가 잊을 만하면 터져 나오고 있다.          지난 4월 대만 동부 해역에 등장한 중국 항모 산둥함을 지켜보고 있는 대만 군인. AFP=연합뉴스       지난달 31일(현지시간) 미국 외교전문지 포린폴리시는 “최근 중국이 대만에 영향을 미치기 위해 새로운 옵션에 주목하고 있다”면서 “에너지야말로 새로운 약점”이라고 지적했다. “섬나라인 대만은 에너지 수요의 97%를 수입에 의존하고 있다”면서 “TSMC만 해도 이미 대만 전체 에너지 소비량의 상당 부분을 차지한다”고 지적했다.      이어 “전면 봉쇄나 군사적 개입 없이도 대만의 에너지 수입을 일정 기간 중단시킨다면 큰 타격을 줄 것”이라고 전망했다. 대만은 석탄의 경우 39일, 천연가스의 경우 불과 11일 수준의 비축량을 보유하고 있는 것으로 알려졌다.      포린폴리시는 TSMC가 갈수록 더 많은 에너지가 필요한 상황에서 대만의 미래 에너지 안보가 점점 위태로워질 것이라 관측했다. 오는 2030년까지 TSMC가 1㎚(나노미터·1㎚는 10억 분의 1m) 공정 양산 계획을 실행하기 위해서는 현재 전력 소비량의 2.6배 수준이 필요할 것으로 분석된다. 대만은 한때 8기의 원자력발전소를 가동했지만 2025년을 목표로 탈(脫)원전을 추진하면서 대부분 석탄과 천연가스 발전에 의존하고 있다.          정근영 디자이너       잇따른 외부의 불안감 어린 시선에도 TSMC가 당장 무게추를 미국 등 외국으로 옮길 가능성은 현재로써는 희박하다. 이런 가운데 지난달 28일 대만 북부 신주 과학단지에서 열린 TSMC 신규 R&D센터 개소식은 “TSMC가 언젠가는 대만을 버리고 떠날 수 있다”는 일각의 우려 섞인 시각을 해소하기 위해 대만 반도체 업계 거물들이 모두 모인 일종의 ‘부흥회’ 현장을 방불케 했다. TSMC가 2025년 양산을 목표로 하고 있는 2나노 최첨단 미세공정 기술을 중점적으로 개발할 신규 R&D센터에는 다음 달까지 7000명이 넘는 반도체 전문 연구인력이 근무할 것으로 알려졌다.          TSMC 본사. 블룸버그       웨이저자 TSMC CEO는 “이 R&D센터가 대만에 뿌리를 유지하고자 하는 회사의 굳은 의지를 보여준다”면서 “TSMC는 전 세계에 생산 투자를 진행하고 있지만 중심을 옮기지는 않을 것”이라고 말했다.      왕메이화 대만 경제부장(장관) 역시 이날 “이제 ‘탈대만화’라는 말은 더는 나오지 않게 될 것”이라고 강조했다. 90살이 넘는 모리스 창도 직접 개소식 현장에 참석해 힘을 실어줬다. TSMC는 최근 대만에 3조7000억원을 투자해 첨단 반도체 패키징 공장을 추가로 짓기로 했다.      강준영 한국외국어대 국제지역대학원 교수는 “미국은 내년 대만 총통 선거와 미국 대선을 앞두고 위기감을 조성해 대만과 TSMC를 중국과 단절시켜 가능한 밖으로 끌어내려 할 것”이라면서 “이에 맞서 대만과 TSMC는 무게중심을 계속 자국에 두고 가능한 버틸 가능성이 크다”고 말했다.",https://n.news.naver.com/mnews/article/025/0003297962?sid=101
"포티투닷, 첫 자율주행셔틀 B2B 서비스",2023-08-01 18:01:03,한국경제,"삼성화재 모빌리티뮤지엄서8인승 차량 5분 간격 운행    현대자동차그룹 계열의 자율주행 기술 업체인 포티투닷이 삼성화재와 함께 경기 용인 모빌리티뮤지엄에서 자율주행 셔틀(사진)을 운영한다고 1일 발표했다.모빌리티뮤지엄 자율주행 셔틀은 포티투닷의 자율주행 통합 플랫폼 ‘탭!’으로 호출해 탑승할 수 있다. 8인승 차량으로 안전 요원을 제외하고 최대 7명이 탈 수 있다. 모빌리티뮤지엄 야외공원 내 자율주행 셔틀 탑승장에서 출발해 트랙 순환 형태로 약 5분 간격으로 운행된다. 자율주행 셔틀은 내부에 장착된 카메라 12대와 레이더 6대가 실시간으로 주변을 인식하며 스스로 달린다.포티투닷의 자율주행 셔틀은 그동안 서울 상암과 청계천 일대에서 시민을 대상으로 운행됐다. 이번 모빌리티뮤지엄 운행을 시작으로 기업 간 거래(B2B) 시장으로까지 자율주행 셔틀 사업을 확장할 계획이다. 회사 측은 기업이 자율주행 셔틀을 도입하면 임직원 출퇴근과 사업장 내 효율적인 인력 이동을 지원할 수 있을 것으로 기대했다. 포티투닷은 자율주행 기술과 플랫폼, 관제시스템(FMS)까지 패키지 형태의 솔루션과 서비스도 개발할 방침이다.",https://n.news.naver.com/mnews/article/015/0004874976?sid=103
