연이은 폭염에 고혈압 주의?…사실 저혈압 더 위험하다는데 [생활 속 건강 Talk],2023-08-06 10:35:01,매일경제,"최고혈압 90에 최저 60이하면 해당기온1도 오를 때 저혈압 환자 1.1%↑짭짤한 음식·식염수 섭취 등 도움돼 오래 서있거나 급격한 자세변화 위험땡볕 아래에 장사는 없다. 평소 혈압이 낮은 사람일수록 더 힘들다. 몸 안에 수분이 땀으로 배출되는 과정에서 현기증과 무기력증이 심해질 수 있기 때문이다. 저혈압으로 병원을 찾는 환자가 매년 7~8월에 가장 몰리는 이유다. 건강보험심사평가원에 따르면 여름철 저혈압 환자는 겨울철보다 2배가량 많다. 홍윤철 서울의대 예방의학교실 교수팀도 기온이 1도씩 오를 때마다 병원을 방문하는 저혈압 환자 수가 1.1%씩 증가한다고 보고한 바 있다.저혈압은 일반적으로 최고 혈압이 90mmHg 이하, 최저 혈압이 60mmHg 이하인 상태를 말한다. 최고 혈압은 심장이 수축하면서 혈액을 내보낼 때, 최저 혈압은 심장이 이완되면서 혈액을 받아들일 때 혈관벽이 받는 압력을 말한다. 혈류가 약하면 몸 속 구석구석까지 충분한 혈액이 도달하지 못해 두통과 구역질, 실신, 현기증 등이 유발된다. 심장이 두근거리는 증상도 동반된다. 윤주희 강북삼성병원 순환기내과 교수는 “혈류가 약해지면 심장은 피를 조금이라도 더 빨리, 먼 곳까지 공급하기 위해 빠르게 뛴다”며 “일종의 보상작용으로 두근거림이 나타나는 것”이라고 말했다.     사진출처=pixabay저혈압 증상이 여름에 더 심해지는 이유는 땀에 있다. 우리 몸의 약 70%를 차지하고 있는 수분은 입으로 들어와 콩팥에서 걸러져 소변, 땀 등으로 배출된다. 체내 수분이 항상 일정량을 유지하는 비결이다. 하지만 기온이 오르면 우리 몸은 체온을 떨어뜨리기 위해 혈관을 팽창시키고 땀을 많이 발생시킨다. 이 과정에서 체내 수분량이 급격히 줄어드는데 이는 혈액흐름에도 영향을 미친다. 체내 수분의 5ℓ가 혈액으로 이뤄져있기 때문이다. 저혈압 환자가 더위 앞에서 기진맥진할 수밖에 없는 이유다.저혈압은 빈혈과 증상이 비슷해 이를 혼동하는 사람도 있다. 하지만 원인이 다르고 치료법에도 차이가 있다. 빈혈은 피에 산소를 공급하는 헤모글로빈이 부족하거나 헤모글로빈이 들어있는 적혈구 수가 적을 때 발생한다. 반면 저혈압은 순환이 잘 되지 않을 뿐 피 자체에는 아무런 문제가 없다. 어지러움이 느껴졌을 때 의료기관을 찾아 정확한 진단을 받아야 하는 이유다.저혈압은 고혈압과 달리 정해진 치료법이 없다. 다만 증상이 심각해 일상생활에 지장이 생길 경우 혈액 순환을 돕는 호르몬제나 혈압을 높이는 약 등을 사용하기도 한다.     사진출처=pixabay전문가들은 무엇보다 평소에 물을 많이 마셔야 한다고 입을 모은다. 땀으로 배출하는 수분이 많을수록 물 섭취는 필수다. 꾸준한 운동과 충분한 수면도 혈액 순환에 도움을 준다. 반면 술과 찜질방은 되도록 멀리하는 것이 좋다. 둘 다 혈관을 확장시켜 혈압을 낮추기 때문이다. 또 장시간 뜨거운 물에 몸을 담그는 것도 체내 수분을 증발시킬 수 있다는 점에서 지양해야 한다.정미향 서울성모병원 순환기내과 교수는 “사우나를 오래 하면 혈관이 이완되고 땀 배출량이 많아져 기립성 저혈압이 나타날 수 있다”며 “오래 서있거나 갑자기 자세를 바꾸는 것도 위험하기 때문에 가급적 천천히, 심호흡하면서 움직이는 것이 좋다”고 말했다. 이어 “직업 특성상 장시간 서있는 자세를 유지해야 한다면 압박 스타킹을 사용하는 것이 낫다”고 덧붙였다.적절한 염분 섭취도 저혈압 증상을 완화하는 데 도움을 준다. 윤 교수는 “단순히 물만 많이 먹으면 체액의 전해질 농도가 낮아져 삼투압 현상에 따른 부작용이 발생할 수 있다”며 “고혈압 환자라면 싱겁게 먹어야 하지만 저혈압 환자는 살짝 짭쪼름한 음식과 식염수 등을 적당량 섭취하는 것이 좋다”고 말했다.     ]사진 출처=픽사베이]",https://n.news.naver.com/mnews/article/009/0005168747?sid=103
"""전장 리더십 확보""…삼성·LG전자, 내달 獨모터쇼 간다",2023-08-06 10:34:01,서울경제,IAA 모빌리티에 나란히 참가자사 기술력·미래 비전 공개    삼성전자가 올해 초 ‘CES 2023’에서 공개한 차량용 솔루션인 ‘레디케어’에 관람객이 탑승해 체험하고 있다. 연합뉴스[서울경제] 삼성전자와 LG전자가 다음 달 5~10일 독일 뮌헨에서 열리는 국제 모터쇼 ‘IAA 모빌리티 2023’에 처음으로 동반 참가한다. IAA 모빌리티는 세계 4대 모터쇼 중 하나로 세계적인 자동차 제조·공급 업체가 모여 최신 혁신 기술을 공개하고 자동차의 미래를 설계하는 자리다. 특히 이번 전시회에서는 2029년까지 연평균 14% 성장이 예상되는 전장 분야에 대한 논의가 활발히 이뤄질 것으로 보인다.6일 전자업계에 따르면 삼성전자는 반도체를 담당하는 디바이스솔루션(DS) 부문이 삼성디스플레이·삼성SDI와 함께 IAA 모빌리티에 참가한다. 특히 이번 전시회에서는 자사 차량용 반도체의 기술력을 과시한다는 계획이다. 삼성전자는 차량용 반도체 시장이 2030년 이후 서버·모바일과 함께 3대 응용처가 될 것으로 보고 이 분야 육성에 공들이고 있다. 실제 올 6월 현대자동차와 차량용 인포테인먼트 칩 ‘엑시노스 오토 V920’ 개발 협력을 맺는 등 가시적 성과도 나오고 있다. 김재준 삼성전자 메모리사업부 부사장은 지난달 열린 2분기 실적 발표회에서 “앞으로도 경쟁력 있는 제품을 기반으로 고객사와 협업하며 차량용 시장에서의 리더십을 강화하겠다”고 말했다.LG전자는 IAA 모빌리티에 스폰서 자격으로 참가해 개막 전날인 다음 달 4일 프레스 콘퍼런스를 열고 모빌리티에 대한 미래 비전을 공개한다. LG전자 측은 “IAA 모빌리티에서 처음으로 미래의 차량 내 경험에 대한 비전을 제시하고 고객과 파트너에게 고도화된 모빌리티 생태계를 제안할 것”이라고 설명했다.LG전자 전장사업은 △차량용 인포테인먼트 시스템(VS사업본부) △전기차 파워트레인(LG마그나 e파워트레인) △차량용조명시스템(ZKW) 등 3개 사업을 주축으로 10년간 연평균 30% 수준의 성장세를 보여왔다. 전장 수주 잔액은 올해 말 100조 원을 목표로 하고 있다. 조주완 LG전자 사장은  간담회에서 “VS사업본부는 2030년까지 매출 약 20조 원 이상 규모로 미래 자동차 시장에서 글로벌 톱 수준 회사로 성장할 것”이라고 말했다.,https://n.news.naver.com/mnews/article/011/0004222977?sid=101
K-초전도체 뜨면 삼성전자에게 호재? 악재? [MK위클리반도체],2023-08-06 10:33:01,매일경제,"초전도체 실험 영상이차전지의 열풍이 식기도 전에 대한민국을 넘어 전 세계를 뜨겁게 달구는 새로운 이슈메이커가 등장했습니다. 바로 ‘초전도체’죠. 국내 연구진이 ‘상온 초전도체’를 개발했다고 발표하면서 논란이 되고 있습니다. 사실이라면 ‘노벨상은 기본’이라는 말이 초전도체 관련 주식들도 테마주를 형성하며 연일 들썩이고 있습니다. 일각에서는‘대한민국은 이제 반도체 대신 초전도체의 나라’가 될 거라는 얘기도 나오고 있죠.이처럼 전국이 들썩이지만 초전도체는 비전공자들에게 사실 생소한 개념입니다. 이 때문에 자연스럽게 다음과 같은 질문이 나오기도 하죠.     네이버 지식인 中과연 초전도체 사회가 현실이 된다면 삼성전자와 SK하이닉스 같은 반도체 산업에는 어떤 변화가 일어날까요?반도체와 초전도체 뭐가 다른데?반도체는 전기 저항이 도체와 부도체의 중간값을 가진다고 해서 붙여진 이름입니다. 하지만 이름처럼 전류도 절반 정도 세기로 흐르는 것은 아닙니다. 평소에는 아예 전기가 흐르지 않는 부도체로 있다가  빛이나 열을 가하거나 다른 불순물을 섞어 주면 전기 저항이 쉽게 변하여 전류가 흐르도록 바뀌지요. 조건에 따라 전류의 세기를 조절할 수 있고 교류 전류를 직류 전류로 변화시킬 수 있는 등 여러 특성이 있기 때문에 각종 전자기기에서 매우 유용하게 사용이 됩니다.초전도체(Superconductor)는 이름 그대로 ‘슈퍼’ 도체입니다. 전기저항이 ‘0’인 물질이기 때문에 사실상 전기를 무한대로 보낼 수 있습니다. 강한 자기장을 만들 수 있기 때문에 양자 컴퓨터 등 초고속 컴퓨터나 장거리 무손실 송전, 자기공명영상(MRI) 등에 활용됩니다.지금까지 초전도체를 구현하려면 영하 200도 이하의 극저온이나 초고압 환경을 갖춰야만 했습니다.하지만 국내 연구진 퀀텀에너지연구소 측이 개발했다는 물질은 만약 연구 결과가 맞다면 초전도 현상이 섭씨 126.85도(400K)까지 대기압에서 유지됩니다.반도체가 전자 부품의 핵심으로 꼽히는 건 전기를 마음대로 통했다가 통하지 않게 조절할 수 있는 능력 때문입니다. 송전 능력을 극대화 하는 초전도체와는 성격이 근본적으로 다르죠.  때문에 이 둘이 서로를 대체할 수 있는 물질이라고 보기는 어렵습니다.반도체 발열 족쇄 풀어줄 초전도체         김성모 작가 ‘돌아온 럭키짱’ 中  [출처=네이버웹툰]오히려 초전도체가 현실화되면 반도체는 ‘봉인’이 해제되면서 비약적인 능력 상승을 추구할 수 있게 됩니다. 전기저항을 0으로 만들어버리는 초전도체의 특성이 전자기기를 작동할 때 생기는 발열을 없애주기 때문입니다.발열은 반도체가 제 성능을 발휘할 수 없게 만드는 가장 큰 적입니다. 시스템반도체가 고사양을 구현할수록 높은 전압을 요구하기 때문에 더 많은 발열이 생길 수밖에 없죠.  앞서 삼성전자도 발열을 막기 위해 고의로 게임 성능을 낮추는 게임 최적화 시스템(GOS)을 적용하면서 논란이 되기도 했습니다. 당시 한종희 삼성전자 부회장이 직접 주주들 앞에서 사과까지 하는 등 삼성 반도체는 큰 곤욕을 겪었습니다.하지만 초전도체가 도입되면서 발열 문제가 사라진다면 시스템 반도체는 구속해왔던 모래주머니를 벗어던지고 자유로워집니다. 성능에만 집중해 설계되면서 극도의 효율을 만들어낼 수 있습니다.반도체칩 자체 성능 강화에도 기여 가능     D램(왼쪽)과 낸드플래시(오른쪽) 개요도초전도체가 보편화되면 반도체를 보조해주는 것뿐 아니라 ‘반도체‘ 자체의 성능도 올려줄 수 있습니다. 사실 우리가 알고 있는 반도체는 온전한 의미에서 반도체는 아닙니다. 실리콘 같은 반도체 소재를 넘어 반도체칩까지 광의의 의미로 반도체라고 부르죠.사실 반도체 칩 내부에는 상당수의 도체가 같이 섞여있습니다.  예를 들어 위 그림에서 확인할 수 있듯 D램에서 저장소 역할을 하는 캐패시터는 도체입니다. 어디까지나 이론적인 얘기지만 초전도체가 도입될 수 있다면 도체 부품을 대체하면서 메모리 반도체칩 자체의 처리 속도가 대폭 개선될 수 있습니다.아직 ‘초전도체’와 거리두기 중인 반도체 기업들    하지만 아직 우리 반도체 기업들은 상온 초전도체를 개발했다고 주장한 퀀텀에너지연구소 측과 거리를 두고 있습니다. 퀀텀에너지연구소가 파트너로 내세운 주요 대기업들은 “연구소와 협력한 적이 없다”고 밝힌 상태입니다.  퀀텀에너지연구소 홈페이지에 따르면 연구소는 삼성SDI·SK엔펄스(옛 SCK솔믹스)·LG이노텍·포스코·삼성전기 등 주요 대기업을 파트너사로 명시했습니다.하지만 LG이노텍과 삼성전기 등은 연구소측에 파트너사로 자사 이름을 올린 이유를 문의한 것으로 전해졌습니다. 논란이 일자 해당 사이트는 폐쇄된 상태입니다.*세줄 요약*-초전도체가 현실이 되면 반도체로 인한 기기 발열 문제가 자유로워 진다-초전도체가 반도체 칩 내부 도체를 대체하면서 성능을 올려줄 수도 있다-다만 아직까지 결과 입증이 안돼 국내 기업들은 ‘거리두기’ 중이다삼성전자, SK하이닉스 등 국내 대표 기업들부터 TSMC와 인텔까지!글로벌 산업의 핵심인 반도체 기업들에 관한 투자 정보를 매주 연재합니다.아래 ‘기자 페이지’를 구독하시면 소식을 놓치지 않고 받아보실 수 있습니다:)",https://n.news.naver.com/mnews/article/009/0005168746?sid=101
이번 주 전국 2307가구 분양…'래미안라그란데' 견본주택 개관,2023-08-06 10:32:31,머니투데이,"포레나 인천학익 투시도./사진제공=한화이번 주 전국에 2307가구가 공급된다. 서울에서는 강북구 수유동 '수유시그니티'가 청약 접수를 받고 동대문구 이문동 '래미안라그란데'가 견본주택을 연다. 6일 부동산R114에 따르면 8월 둘째 주에는 전국 7개 단지 총 2307가구(일반분양 1512가구)가 분양을 시작한다. 서울 강북구 수유동 '수유시그니티', 인천 미추홀구 학익동 '포레나인천학익', 강원 원주시 단구동 '원주자이센트로' 등에서 청약을 진행한다.한화건설은 인천 미추홀구 학익동 290-1번지 일원에서 학익4주택재개발 정비사업을 통해 '포레나인천학익'을 분양한다. 지하 2층~지상 최고 29층, 5개동, 총 562가구 중 전용면적 49~74㎡ 250가구를 일반분양한다. 미추홀대로를 통해 송도·청라 국제도시 진출입이 용이하며, 수인분당선 인하대역과 학익역(2026년 개통 예정)이 근거리에 위치한다. 단지 주변으로 초중고교 교육시설이 풍부하며 대형마트, 종합병원, 영화관, 법원, 공원 등의 생활 기반 시설이 다양하다.    래미안라그란데 조감도. /사진제공=삼성물산견본주택은 서울 동대문구 이문동 '래미안라그란데', 서울 성동구 용답동 '청계SK뷰', 광주 북구 신용동 '힐스테이트신용더리버' 등 6곳이 개관 예정이다.삼성물산은 서울 동대문구 이문동 257-42번지 일원에서 이문1주택재개발 정비사업을 통해 '래미안라그란데'를 분양할 예정이다. 지하 5층~지상 최고 27층, 39개동, 총 3069가구 중 전용면적 52~114㎡ 920가구를 일반분양한다. 지하철1호선 외대앞역과 신이문역 역세권이며 청량리역 일대 개발에 따른 수혜도 예상된다. 청량리역은 1호선과 수인분당선, 경의중앙선 노선 외에도 앞으로 GTX(수도권광역급행철도) B·C노선이 들어설 예정이며 광역환승센터가 계획돼 있다. 차량 이용 시 내부순환로와 북부·동부간선도로를 통해 서울 전역으로 이동이 편리하다.",https://n.news.naver.com/mnews/article/008/0004921662?sid=101
영국 소비자 매체 접근성 평가에서 삼성 TV  ‘최고’ 인정,2023-08-06 10:32:01,이코노미스트,"비영리매체 ‘위치’ “삼성 Neo QLED 모든 제품의 기준” 극찬    삼성전자 모델이 삼성 TV에 기본 탑재된 접근성 기능을 설정하고 있다. [사진 삼성전자][이코노미스트 ] 삼성 TV가 영국 비영리 소비자연맹지 ‘위지’(Which)에서 ‘최고의 접근성’ 제품으로 선정됐다. 위치는 영국 왕립 시각장애인협회(RNIB, Royal National Institute of Blind People)와 함께 화질·음질·접근성을 기준으로 TV 분야를 평가했다. 이를 통해 삼성 Neo QLED(QE65QN85B)와 OLED(QE55S95B)가 1, 2위로 선정됐다. 이는 시각장애인과 전맹 저시력자를 위한 제품으로 인정받은 것이다. 위치는 “삼성 TV는 접근성 기능에서 ‘모든 제품들의 기준(Gold standard)’이다”고 평가했다. 또한 “(삼성 TV가) 평가 브랜드 중 유일하게 부분 화면 확대 기능을 지원한다”면서 “메뉴에서 텍스트 크기를 편리하게 조절할 수 있고, 다양한 컬러 옵션을 제공해 선명하게 화면을 볼 수 있다”고 평가했다. 삼성전자는 삼성전자는 모든 사람들이 차별없이 즐길 수 있는 ‘스크린 포 올(Screen for all)’을 위해 2013년부터 영국 왕립 시각장애인협회와 지속적으로 협업하고 있다. 삼성 TV는 최근 2회 연속으로 영국 왕립 시각장애인협회로부터 시각장애인 접근성 인증을 획득했다.삼성전자는 2023년 TV 신모델에 색약자를 위한 ‘씨컬러스 모드’(SeeColors Mode)를 기본 기능으로 탑재했다. 색약 정도를 세부적으로 조정할 수 있게 만들어 화면 속 물체를 더 잘 구별해낼 수 있도록 하는 기능이다. 또한 ‘릴루미노’(Relumino) 모드도 개발해 명암·색·선명도 등 화질 요소를 더 강하게 표현했다. 이를 통해 저시력자들이 TV 이미지를 더 쉽게 인지할 수 있도록 했다.",https://n.news.naver.com/mnews/article/243/0000048478?sid=101

“삼성 살아날 것” 전망에…효성이 ‘반도체 세척 가스’ 계속 키우는 이유? [비즈360],2023-08-06 10:29:03,헤럴드경제,"효성화학 옥산공장에 NF3 생산시설 구축…이달 가동 목표효성 NF3 연산 생산능력 1만t → 1만2000t 하반기 반도체 시황 업턴 대비 차원    효성화학 청주 옥산공장 전경. [효성 제공][헤럴드경제=] 효성이 반도체 세척 가스인 ‘삼불화질소(NF3)’의 신규 생산 라인을 이르면 이달 가동한다. 효성화학이 7개 분기 연속 적자를 기록하는 등 실적 부진에도 NF3 사업을 지속 확대하고 있다. 반도체 시황이 하반기 이후 업턴(상승국면) 전환될 것으로 전망되면서 후방 산업군도 이에 대비해 선제적 조치를 강화하는 것으로 풀이된다. 6일 업계에 따르면 효성화학은 최근 청주 옥산공장에 연산 2000t 규모의 NF3 생산시설 구축을 완료, 이달 중 가동을 목표로 시운전을 진행하고 있다. 신규 생산라인이 본격적으로 가동되면 효성그룹의 NF3 생산능력은 기존 1만t에서 1만2000t으로 늘어난다. NF3는 반도체 제조 공정에서 발생하는 이물질을 세척하는 특수 가스다.옥산공장은 그동안 TV에 주로 사용되는 TAC 필름을 주로 생산했다. 효성화학은 옥산공장에 NF3 생산시설을 구축하고자 약 1200억원을 투자했다.효성그룹에서는 효성화학, 효성티앤씨가 NF3를 양산하고 있다. 효성화학은 옥산공장과 울산 용연공장(연산 6000t)에 연산 8000t의 규모의 생산체제를 구축했다. 효성티앤씨의 중국 취저우 공장에서 생산되는 NF3 규모는 연산 4000t이다. 효성의 NF3는 순도 99.995% 이상이다. 효성이 NF3 신규 생산시설을 구축하는 과정은 결코 쉽지 않았다. 지난해 말부터 전방 사업인 반도체 시황이 악화됐을 뿐만 아니라 증설을 결정한 효성화학은 2021년 4분기부터 올해 2분기까지 7개 분기 연속 적자를 기록하기도 했다. 계속된 적자에 효성화학은 수익성이 떨어진 대전 나일론 필름 생산라인 철수를 검토하고 있다.    효성이 생산하는 반도체 세척 가스 ‘NF3’. [효성 제공]반면 효성은 반도체 시장이 이른 시일에 반등할 가능성이 크다고 판단, 증설을 진행했다. 실제 삼성전자를 비롯한 반도체 업계는 반도체 시장 악화가 올해 2분기 정점(피크아웃)을 찍었다고 판단하고 있다. 김재준 삼성전자 메모리사업부 부사장은 올해 2분기 실적콘퍼런스콜에서 “고객사 재고 조정이 상당 수준 진행됐다”며 “하반기 D램에서 특수 공정이 적용된 제품들은 수요 증가가 예상된다”고 설명했다.이에 NF3 시장 성장 가능성도 점쳐진다. 시장조사기관 마켓인사이트리포트에 따르면 글로벌 NF3 시장 규모는 지난해 14억2430만달러(약 1조9000억원)에서 2029년 2배 이상 성장한 34억910만달러(약 4조5000억원)에 달할 것으로 예상된다.효성은 현재 글로벌 NF3 시장에서 점유율 2위를 기록하고 있다. 옥산공장 내 NF3 생산라인 가동 시 선두인 SK㈜ 머티리얼즈(1만3500t)와의 격차는 1500t에 불과하다. 성장 가능성이 큰 만큼 시장 주도권을 둘러싸고 SK㈜ 머티리얼즈와 효성 간 경쟁은 더욱 치열해질 전망이다.효성은 NF3를 포함해 신소재 사업 키우기에도 주력한다. 효성첨단소재는 2028년까지 1조원을 투자해 슈퍼섬유인 ‘탄소섬유’ 생산능력을 연산 2만4000t으로 확대할 예정이다. 현재는 연산 9000t의 탄소섬유를 생산하고 있다. 효성첨단소재는 내년에 생산능력을 연산 1만4000t까지 늘릴 계획이다.",https://n.news.naver.com/mnews/article/016/0002179615?sid=101
