[파워인터뷰]“한국-대만 반도체 협력 강화해야 中-北 위협도 대처 가능”,2023-08-06 23:46:01,동아일보,"뤼슈롄 전 대만 부총통    지난달 28일 서울 종로구 동아미디어센터에서 만난 뤼슈롄 전 대만 부총통은 “중국과 북한의 위협을 공통적으로 받고 있는 한국,  대만, 일본 3개국은 ‘입’과 ‘혀’의 관계”라며 일종의 운명 공동체인 3개국이 협력을 강화해서 대처해야 한다고 강조했다. 최혁중  기자",https://n.news.naver.com/mnews/article/020/0003513429?sid=110
투자 유치 커녕 수습만… ‘수조원 신기루’ 된 잼버리,2023-08-06 23:43:01,서울신문,"영국 이어 미국 등 잇단 철수 결정민관, 관광·시설 등 확대 나섰지만기대한 새만금 인프라 구축 ‘빈축’    2023 새만금 세계 스카우트 잼버리에서 조기 퇴영한 영국 스카우트 대원들이 6일 서울 용산역에서 잼버리 관련 뉴스를 바라보고 있다.     부안 연합뉴스6조 4656억원. 새만금 세계스카우트 잼버리 유치를 즈음해 전북연구원이 사회간접시설(SOC) 조기 구축 등을 감안해 추산한 경제적 파급효과 규모다. 지난 2일 개영식에서 온열환자가 108명에 이른 것으로 3일 집계되고, 5일 영국·미국·싱가포르 참가자가 철수를 결정하면서 경제효과에 대한 기대는 ‘한여름밤의 꿈’처럼 돼 버렸다.휴가 중인 윤석열 대통령이 6일 “무더위 위생관리에 만전을 기해 달라. 특히 식중독 등이 일어나지 않도록 각별하게 살펴 달라”고 한덕수 국무총리와 이상민 행정안전부 장관에게 유선 지시를 내렸지만, 지금부터 잘하더라도 ‘절반의 성공’에 그칠 것이란 관측이 나온다.‘새만금 잼버리’에서 ‘코리아 잼버리’로민관 합심해 대외 신뢰도 높이기 구슬땀    공군 블랙이글스가 새만금 잼버리를 축하하는 에어쇼를 6일 전북 부안군 야영장 상공에서 펼치고 있다 .    부안 연합뉴스    한덕수 국무총리가 6일 오후 전북 부안군 새만금 세계스카우트잼버리 현장을 찾아 임시상황실에서 이상민 행정안전부 장관과 대화하고 있다.  총리실 제공윤 대통령 지시에 따라 정부는 서울·부산·강원 평창·경북 경주 등과 연계해 관광프로그램을 긴급 추가하고 새만금 영지 시설 또한 계속 확충하고 있다. 삼성을 비롯한 민간기업과 경제단체도 물품 지원 및 의료 지원 등에 나섰다. 잼버리 초기 파행으로 인한 대외 신뢰도 하락을 만회하고 한국을 찾은 세계 청소년들을 보호하기 위해 민관이 합심한 모습이다.‘잼버리’ 앞세워 공항 예타 면제중앙·지방정부 앞다퉈 SOC 투자    6일 전북 부안군 새만금 환경생태단지에서 열린 ‘새만금 잼버리 기념숲’ 식재 행사에서 김관영 전북도지사와 스카우트 대원들이 기념촬영하고 있다.  전북도 제공1000억원 규모 예산 사업인 새만금 잼버리를 계기로 경제적 파급효과를 6조원까지 계산한 건 잼버리에 맞춰 지역 숙원 SOC 건설이 급물살을 탈 수 있어서다. 일례로 주변 군산·여수 공항과 역할이 겹친다는 이유로 추진이 지지부진하던 새만금 공항 개발 사업은 2019년 1월 ‘국가균형발전 프로젝트’로 선정되면서 예비타당성조사 면제 대상이 됐다. 전북도는 “2023 잼버리 대회 이전 착공될 수 있도록 연차별 국비 확보를 추진한다”는 전략을 내세워 새만금 공항 건설을 추진했고, 지난해 5월 국토교통부는 2029년 개항을 목표로 총사업비 9359억원의 새만금 국제공항 개발사업 기본계획을 발표했다.잼버리 편의를 명분으로 내세우며 도로망도 확충됐다. 새만금엔  2020년 11월 완성된 동서도로(16.5㎞)만 있었는데, 잼버리에 참석하는 4만 3000명의 교통 편의를 높인다는 이유로 지난달 26일 남북도로(27.1㎞)가 완공됐다. 공사 기간 4년 8개월, 사업비 4249억원이 들어간 도로다. 여기에 전주~새만금 고속도로도 추진되고 있다.캠핑 평탄화도 못하는데 활주로 건설?잼버리 혼란 후폭풍… 개발 악재 될까    새만금 잼버리 참가자들이 6일 전북 부안군 야영장 간이풀장에서 물놀이하고 있다 .  부안 연합뉴스    새만금 잼버리에서 조기 퇴영한 영국 스카우트 대원들이 6일 밤 광화문 서울 시티투어버스에 탑승해 출발 전 환호하고 있다. 연합뉴스지지부진했던 새만금에 대한 교통 인프라 투자가 활성화됐던 배경에는 ‘잼버리 성공 개최를 계기로 전 세계에 새만금 입지의 우수성을 알린다’는 낙관적인 기대가 깔려 있었다. 그래서 광역·기초단체뿐 아니라 중앙정부까지 적극 나서서 새만금에 대한 SOC 투자를 적극 모색한 것이다. 실제 잼버리 개영식이 열렸던 지난 2일 윤 대통령은 잼버리 행사에 앞서 새만금에 조성되는 ‘이차전지 특화단지’ 쪽을 방문하기도 했다.하지만 향후 새만금의 과제는 잼버리로 인해 생긴 ‘오명’을 씻어내는 일이 될 것으로 보인다. 신공항 건설을 위해선 ‘캠프장 부지도 조성하지 못하는데 개척지에 만들 활주로 평탄화 작업을 해낼 수 있겠느냐’는 의구심을 해소하는 일이 급선무가 됐다. 잼버리에 맞춰 개통한 도로 역시 ‘새만금을 찾게 만드는 유입로’가 아니라 ‘새만금 탈출로’로 연상될 판이다.장기적인 이미지 실추 외에 단기적인 경제적 손실도 일어날 것으로 예상된다. 앞서 전북연구원은 국내외 방문객이 전북에서 17억원가량을 소비할 것으로 내다봤다. 영외활동이 다른 시도로 분산되면서 기대는 공염불에 그치게 됐다.",https://n.news.naver.com/mnews/article/081/0003382911?sid=102





"한총리 ""책상에 있지 말고 현장 가라""…직접 화장실 청소도(종합)",2023-08-06 22:57:31,연합뉴스,"무제한 냉동생수·쿨링버스 254대…잼버리 현장에 인력·물품 집중화장실·샤워장 청소인력 70명→894명…한총리 ""화장실, 정말 완벽하게 하라""    잼버리 생수 지원  = 6일 전북 부안군 2023 새만금 세계스카우트잼버리 야영장 내에 지원된 생수가 놓여 있다 . 2023.8.6 kan@yna.co.kr  = 2023 새만금 세계스카우트잼버리 대회 야영장 환경 개선을 위해 물품과 인력 지원이 집중적으로 이뤄지고 있다.    6일 잼버리 조직위원회 집계에 따르면 현재 냉동 생수는 1일 10만병으로 사실상 무제한 제공되고 있다. 정부 대응 전에는 1인당 생수 1병씩이 제공됐다.    아울러 팔토시, 쿨링마스크, 선크림, 양산 등이 추가 제공됐고 냉장냉동 탑차 10대, 대형선풍기 200대, 임시 물놀이장 및 물터널 5개소가 새로 마련됐다.    기존 4대였던 적십자 버스(1대당 휴대용 침대 10개)는 9대로 늘어났고, 254대의 '쿨링버스'(냉방버스·1대당 40명 수용)가 추가 투입됐다.    그늘 쉼터 확대를 위한 위장막 및 캐노피도 64개가 설치됐다.    기존 70명이던 화장실·샤워장 청소 인력은 894명까지 늘어났고, 청소 횟수도 확대됐다. 이동식 화장실은 62동이 추가 설치됐다.    전문 의료인력도 추가 배치됐다. 서울대병원(11명), 세브란스병원(36명), 고대 안암병원(10명), 중앙대병원(3명), 서울삼성병원(13명), 중앙의료원(10명) 등이 현장에 파견됐다.    한덕수 국무총리도 이날 오후 전북 부안군 새만금 세계스카우트잼버리 현장을 찾아 정부 대응 상황을 점검했다.    한총리, 사흘연속 잼버리 현장점검 한덕수 국무총리가 6일 오후 전북 부안군 새만금 세계스카우트잼버리 현장을 찾아 대응 상황을 점검하고 있다.  2023.8.6 [총리실 제공, 재판매 및 DB 금지] photo@yna.co.kr사흘 연속 대회장을 찾아 직접 현장을 챙긴 것이다.    한 총리는 이날 공동조직위원장인 김현숙 여성가족부·이상민 행정안전부·박보균 문화체육관광부 장관에게 ""끊임없이 현장을 돌아보며 참가자들 의견을 듣고 문제점을 파악해 확실히 해결하라""고 지시했다고 국무조정실이 보도자료를 통해 전했다.    그러면서 ""문제점이 상당 부분 개선되고 있지만 아직도 충분하지 않다""며 조직위에 추가 지시를 내렸다.    우선 샤워시설 등 편의시설 청결 유지를 위해 긴급 추가 투입된 인력 약 700여명에게도 충분한 물을 공급하고 휴식을 보장하라고 지시했다.    한 총리는 영내 활동 중인 참가자들을 만나 ""불편한 점이 없느냐"", ""고칠 점을 말해달라""고 묻기도 했다.    적십자 재난회복지원 차량에서 휴식을 취하고 있는 한 참가자는 한 총리에게 정부 등의 도움이 훌륭하다며 감사를 표하기도 했다고 국조실은 전했다.    한 총리는 조직위가 안내하는 편의시설만 둘러보지 않고, 참가자들이 지적한 곳을 중심으로 영지 외곽에 있는 시설을 무작위로 불시 점검하기도 했다.    또 점검 내용과 대회 관계자들의 답변이 다른 경우 ""현실과 일치하지 않는다""며 ""책상에 앉아있지 말고 현장에 나가 다시 조치한 뒤 보고하라""고 말했다.    사흘연속 잼버리 현장 찾은 한덕수 국무총리 한덕수 국무총리가 6일 오후 전북 부안군 새만금 세계스카우트잼버리 현장을 찾아 임시상황실에서 이상민 행정안전부 장관과 대화하고 있다. 2023.8.6 [총리실 제공, 재판매 및 DB 금지] photo@yna.co.kr지난 4일에는 한 총리가 점검 도중 직접 화장실 청소에 나선 사실이 뒤늦게 알려지기도 했다.     '숙영장 중심부는 상태가 좋은데 외곽이 문제'라는 한 유럽 국가의 스카우트연맹 관계자의 의견을 듣고 즉석에서 해당 지역을 점검하던 중이었다.    한 총리는 이후 소집한 조직위 관계자들에게 ""저도 오늘 화장실에 남이 안 내린 물을 내리고, 묻은 것도 지웠다""며 ""군대 갔다 온 분들은 사병 때 화장실 청소를 해봤을 것 아니냐. 누구에게 시킬 생각만 하지 말고 직접 청소도 하라""고 말했다.    그러면서 ""저도 여기 화장실 청소하러 왔다""며 ""특히 화장실은 정말 책임지고 완벽하게 하라""고 강력히 지시했다고 한 총리실 관계자는 전했다.    한 총리는 이날도 직접 화장실을 찾아 위생 상태 등을 점검했다.    한총리, 사흘연속 잼버리 현장점검 한덕수 국무총리가 6일 오후 전북 부안군 새만금 세계스카우트잼버리 현장을 찾아 대응 상황을 점검하고 있다.  2023.8.6 [총리실 제공, 재판매 및 DB 금지] photo@yna.co.kr",https://n.news.naver.com/mnews/article/001/0014115576?sid=100



"부채 35조 넘는데…한국도공, 38억 들여 전직원 태블릿PC 지급",2023-08-06 22:26:00,중앙일보,"경북 김천시 도로공사 사옥. 중앙포토       한국도로공사와 자회사 한 곳이 약 38억원을 들여 전 직원에게 태블릿 PC를 지급했으나 퇴직자들이 이를 그대로 가지고 퇴사하는 등 관리 부실 문제가 있었던 것으로 드러났다.       국회 국토교통위원회 소속 강대식 국민의힘 의원이 제출받은 자료에 따르면 한국도로공사와 자회사 한국도로공사서비스는 총 38억의 예산을 들여 지난 2021년 전 직원 1만 5000여명에게 교육용으로 태블릿 PC를 한 대씩 지급했다.        두 차례의 공고 유찰 끝에 삼성전자가 공급자로 선정됐고 한국도로공사는 갤럭시 탭 A7 모델을 8805대를, 도로공사서비스는 갤럭시 탭 A8을 6317대를 구입했다.        한국도로공사는 코로나19에 따라 온라인 교육을 활성화하고 재택근무를 지원하기 위해 노사 협상에 따라 일시적으로 태블릿PC를 도입했다고 밝혔다. 한국도로공사서비스도 현장 교대 근무자들이 사무실에서 교육받기 어려운 특수성을 반영해 이같은 결정을 했다고 설명했다.        다만 태블릿PC는 사무실PC로도 교육이 가능한 사장과 임원급에게도 지급됐으며, 도로공사서비스의 경우 지급 인원 중 약 2000명은 교대 근무자가 아니었던 걸로 드러났다.        태블릿PC는 교육용 전산소모품이라 물품예규관리에 따라 공사의 부외자산으로 관리됐지만, 퇴사한 직원 1400여명은 태블릿PC를 그대로 가지고 퇴사했다.      퇴사 직원으로부터 반납받은 태블릿은 31대로 회수율은 2%에 그쳤다.      한국도로공사의 부채가 지난해 한때 35조원을 넘어서는 상황에서 방만 경영이 아니냐는 지적이 일자 두 기관은 퇴직자 PC 회수를 서두르겠다고 SBS에 밝혔다.",https://n.news.naver.com/mnews/article/025/0003298893?sid=100












"“야구장 예고 글, 해외 IP”…경북 ‘살인 예비’ 구속",2023-08-06 21:54:52,KBS,"[KBS 대구]어제(5일) 대구 삼성라이온즈파크 흉기 난동 예고 글과 관련해 경찰이 작성자에 대한 추적을 이어가고 있습니다.대구경찰은 어제 흉기난동 예고 글이 외국 IP 주소에서 작성된 사실을 확인했으며, 오늘도 야구장에 경찰 백여 명을 투입하고 관중 입장 때 금속탐지기로 검색하는 등 경비를 강화했다고 밝혔습니다.",https://n.news.naver.com/mnews/article/056/0011540243?sid=102

"미·중, 탄소중립 향해 태양광 공격적 투자…한국은 되레 후퇴",2023-08-06 21:49:01,경향신문,"중국, 올 4월까지 태양광 설비 설치 작년 대비 190% 확대…미국도 증가한국은 재생에너지 규제 강화…올해 국내 태양광 신설은 16% 감소할 듯글로벌 트렌드 역행…수출입은행 “정부, 신재생에너지 목표치 하향 탓”    ‘2050 탄소중립’을 선언한 삼성전자는 지난해 온양사업장에 0.2㎿(메가와트) 규모의 태양광 발전 설비를 설치했다고 ‘2023년 지속 가능 경영보고서’에서 밝혔다. 앞서 삼성전자는 수원사업장과 기흥사업장에 각각 1.9㎿, 1.5㎿ 규모의 태양광 발전 설비를 구축했다. 그러나 이런 규모로는 연간 전력 생산량이 평균 5GWh(기가와트시) 남짓에 불과하다.6일 삼성전자에 따르면 자체 발전으로는 한계가 있어 한국전력에서 전기를 살 때 웃돈을 지급하는 대가로 재생에너지를 사용한 것으로 인정받는 ‘녹색프리미엄’ 제도를 통해 수백 GWh의 재생에너지를 조달하고 있다. 하지만 이렇게 해도 한 해 2만GWh에 가까운 전력 수요를 충당하기에는 턱없이 부족하다. 게다가 2042년 경기 용인·평택에 세계 최대 반도체 클러스터까지 들어서면 재생에너지 부족 문제가 두드러질 것으로 예상된다.경기도는 2021년 기준 재생에너지 발전 비중이 2.5%로 전국 평균(6.9%)에 한참 밑돈다. 그런데도 정부는 경기도에 신규 액화천연가스(LNG) 화력발전소 건설만 검토 중인 것으로 전해졌다. 부족한 전력은 대규모 송전망 건설을 통해 호남과 강원·경북 지역에서 끌어올 계획이다.삼성전자에 탄소중립은 이익과 직결된 문제다. 애플은 삼성전자 등 공급업체들을 대상으로 2030년까지 제조 과정에 재생에너지 100% 사용을 요구하고 있다.최근 LG화학과 한화솔루션 등 몇몇 기업들은 재생에너지 발전사업자와 ‘재생에너지 공급 인증서(REC)’ 장기 구매계약 체결에 나서고 있다. REC는 발전사업자가 재생에너지 설비를 이용해 전기를 생산했음을 증명하는 인증서다. 기업들이 REC를 구매하면 재생에너지 사용 실적으로 인정받을 수 있다. 그러나 국내에선 재생에너지 공급량 자체가 부족해 이마저도 여의치 않은 상황이다. 이 때문에 통신사와 유통사 등 국내 사업 비중이 큰 기업들의 재생에너지 사용 비율은 0.1%도 안 되는 등 RE100(재생에너지 100% 사용) 이행에 속도를 내지 못하고 있다.규제와 인허가 지연으로 재생에너지 조달에 드는 비용이 유럽의 1.5~2배 수준에 달하는 점도 기업에는 부담이다.최근 재생에너지에 대한 규제가 강화됨에 따라 기업들의 RE100 달성은 더 어려워질 것으로 예상된다. 한국수출입은행이 최근 발표한 ‘2023년 상반기 태양광산업 동향 보고서’를 보면 2030년 신재생에너지 비중을 21.6%로 하향 조정하는 등 정부 정책 변화 때문에 올해 국내 태양광 발전 설치량이 2.5GW(기가와트)로, 전년 대비 16.7%나 감소할 것으로 예측됐다.이는 태양광 발전 시장이 폭발적으로 성장하는 중국, 미국과 대조적이다. 중국은 올해 4월까지 태양광 발전 설치 규모가 지난해 같은 기간보다 190% 뛴 48GW를 기록했다. 세계 2위 태양광 시장인 미국도 수요가 늘어나면서 수출입은행은 올해 미국 태양광 신규 설치 전망치를 30GW에서 35GW로 상향 조정했다.수출입은행은 보고서를 통해 “가뭄과 태풍 등 기후변화에 따른 피해가 급증함에 따라 화석에너지 사용을 낮추고 태양광 등 신재생에너지 사용을 확대할 필요성이 두드러지고 있다”며 “온실가스 배출량의 40%를 차지하는 발전 분야 청정화는 불가피하다”고 지적했다.",https://n.news.naver.com/mnews/article/032/0003240988?sid=101
"삼성·LG전자, 내달 독일 모터쇼 참가…현대차그룹은 내년 ‘CES’ 준비 전념",2023-08-06 21:46:07,경향신문,"경계 허물어진 전자와 자동차삼성, 첫 참가…반도체 수요 발굴LG, ‘전장’의 주력 사업 부상 과시현대차, IT·모빌리티 접목에 진심삼성전자와 LG전자가 다음달 5~10일(현지시간) 독일 뮌헨에서 열리는 국제 모터쇼 ‘IAA 모빌리티 2023’에 참가한다. 특히 삼성전자의 모터쇼 참가는 이번이 처음이다. 전기차·레벨3 자율주행차 등의 보급으로 자동차 전장(전기·전자 장치) 시장이 확대되면서 국내 전자업체들도 경쟁에 본격 가세하는 모습이다.6일 업계에 따르면 삼성전자는 반도체를 담당하는 디바이스솔루션(DS) 부문이 IAA 모빌리티에 참가한다. IAA 모빌리티는 세계 4대 모터쇼 중 하나다. 자회사인 하만, 전자 계열사인 삼성SDI 등이 국제 모터쇼에 제품을 전시한 적은 있지만, 삼성전자가 직접 참가하는 것은 처음이다. 삼성전자는 이번 전시회에서 첨단운전자보조시스템(ADAS) 및 인포테인먼트(IVI) 프로세서·메모리, 이미지 센서 등을 집중 소개할 것으로 알려졌다.삼성전자 DS 부문의 모터쇼 참가는 최근 자율주행 관련 기술이 발전하면서 차량용 반도체 시장이 빠르게 성장하고 있기 때문으로 분석된다. 삼성전자는 2030년 이후 자동차가 서버, 모바일과 함께 3대 반도체 수요처가 될 것으로 전망한다.삼성전자 DS 부문은 질화갈륨 웨이퍼를 기반으로 한 전력반도체 파운드리(위탁생산) 서비스도 2025년부터 시작한다. 질화갈륨 기반 반도체는 기존 실리콘 웨이퍼보다 고압·고열에 강해 차량용 등에 폭넓게 쓰일 것으로 예상된다.LG전자는 IAA 모빌리티 개막 전날 간담회를 열고 모빌리티 미래 비전을 공개할 예정이다. LG전자 관계자는 “차량부품솔루션(VS) 사업이 이제 LG전자 주력 사업으로 부상했다는 점을 전 세계에 공표한다는 취지”라고 설명했다.2013년 전장 사업에 뛰어든 LG전자는 차량용 IVI 시스템(VS사업본부), 전기차 파워트레인(자회사 LG마그나 이파워트레인), 차량용 조명 시스템(자회사 ZKW) 등 3개 사업을 중심으로 10년간 연평균 30% 수준 성장세를 보여왔다. 특히 그간 적자를 면치 못했던 VS사업본부가 지난해 2분기부터 흑자 전환에 성공하는 등 성장 속도가 빠르다. VS사업본부의 수주 잔액은 올해 말 100조원에 이를 것으로 예상된다.반면 현대자동차는 이번 모터쇼에 불참한다. 모터쇼 참석 비용 대비 얻을 수 있는 이익이 적고, 새롭게 공개할 신차가 없기 때문으로 풀이된다.대신 현대차는 내년 초 미국 라스베이거스에서 열리는 세계 최대 전자·정보기술(IT) 전시회인 ‘CES 2024’ 참가를 준비하는 것으로 알려졌다. 앞서 현대차는 2022년 CES에 정의선 회장까지 참석해 도심항공교통(UAM) 등 미래 모빌리티 비전을 발표한 바 있다.업계 관계자는 “자동차는 이제 첨단 전자제품, IT 플랫폼에 가까워지고 있다”면서 “전자 업계와 자동차 업계의 경계는 이미 허물어지기 시작했다”고 말했다.",https://n.news.naver.com/mnews/article/032/0003240986?sid=101
미숙한 잼버리 운영이 또…이번엔 축구팬들 '뿔났다',2023-08-06 21:46:01,한국경제,"갑작스러운 장소 변경으로 K리그 경기 일정 변경축구 팬들 ""숙소, 차편 예약한 사람들 피해"" 불만    전주월드컵경기장. 사진=연합뉴스'2023 새만금 세계스카우트 잼버리'의 미숙한 운영이 이번에는 축구계에 불똥이 튀었다. 잼버리 K팝 콘서트 장소가 일방적으로 전주월드컵경기장으로 변경되면서, 축구 경기 일정이 변경되자 경기를 기다리던 축구 팬들이 크게 반발하고 있다.전북 현대는 6일 사회관계망서비스(SNS)에 ""2023 새만금 세계스카우트잼버리의 K팝 공연 행사 및 폐영식이 오는 11일 전주월드컵경기장에서 열리게 됐다. 따라서 다음주 진행 예정이었던 홈 2경기에 대한 일정이 변경될 예정""이라며 ""갑작스러운 경기 일정 변경으로 팬분들께 혼선을 드려 양해를 구한다. 경기와 관련하여 세부 사항이 결정되는 즉시 안내하겠다""고 공지했다.    사진=전북 현대 페이스북전북은 9일 인천 유나이티드와 대한축구협회(FA)컵 4강전, 12일 수원 삼성과 K리그1(1부) 26라운드를 치를 예정이었다. 하지만 11일 콘서트를 개최하게 되면서 무대, 시설물 설치와 해체 등의 작업으로 인해 홈경기를 치를 수 없게 됐다. 전북 현대 구단은 공지에 ""인천 유나이티드 전 예매자 전액 환불"", ""수원전 예매 일정은 추후 오픈 예정""이라고 공지를 올렸다.이에 대해 축구 팬들이 거세게 반발하고 있다. 한 네티즌은 전북 현대 공지에 대한 답글에 ""여름철 잔디 예민한 시기에 왠 콘서트냐""라고 지적했다. 또 다른 네티즌은 전북 현대 공식 인스타그램에 올라온 공지사항 댓글로 ""이미 숙소,차편 예약한 사람은 어떡하냐""며 불만을 표출했다.한편 정부는 수용 인력과 이동 조건 등을 종합적으로 고려해 잼버리 K팝 콘서트 장소를 전주월드컵경기장으로 바꿨다고 해명한 바 있다. 박보균 문화체육관광부 장관은 이날 ""전주월드컵경기장 수용인원은 4만2000명이며, 관중석 88%에 지붕이 설치돼 있다""며 ""새만금에서 이동 시간은 대략 50분 정도""라고 일정과 장소 변경 이유를 설명했다.",https://n.news.naver.com/mnews/article/015/0004876737?sid=102
"삼성전자, 가장 한국적으로…‘갤럭시 Z 플립5·폴드5’ 3D 옥외 광고[포토뉴스]",2023-08-06 21:46:05,경향신문,삼성전자가 다음달 30일까지 서울 강남구 코엑스에서 신사임당의 ‘초충도’를 모티브로 제작된 3D 옥외 광고를 선보인다고 6일 밝혔다. 사진은 지난 3일 코엑스에서 선보인 ‘갤럭시 Z 플립5·폴드5’ 3D 옥외 광고 모습.,https://n.news.naver.com/mnews/article/032/0003240985?sid=105




